app_id,reviewId,userName,score,at,content,thumbsUpCount,replyContent,repliedAt,scraped_at
com.tokopedia.tkpd,67910c92-4ae1-48b4-ac9c-c460df6630d0,Rizal Ulhaq,1,2026-03-30 09:10:01,"Langganan Plus Mahal pun tetap masih ada Bug Errornya berasa gak langganan, tidak ada gratis ongkir, tidak ada diskon 5% s/d 200K dan tidak ada voucher lainnya,, di chat CS nya jawaban selalu sama ""Anda tidak mendapatkan keuntungan dari langganan"",, ngapain saya langganan mahal2 klo gak dapat keuntungan??",3,,,2026-04-20 20:04:16
com.tokopedia.tkpd,6ebfb8a9-0be6-4f37-9441-540bedbcc896,Carel Manarisip,5,2026-03-30 08:55:04,tokopedia loding di hp samsung a13 kenapa sering eror.,0,,,2026-04-20 20:04:16
com.tokopedia.tkpd,13c34e7f-13e7-41b5-9d0a-05dbd3d8d155,Dodon Her,4,2026-03-30 08:50:06,"aslinya bagus aplikasi ini, cuman ongkirnya aj yg gak ngotak, KLO mau co meski nunggu voucher atau tanggal kembar sih",0,,,2026-04-20 20:04:16
com.tokopedia.tkpd,35e862a3-a455-4e4d-a387-30b6b594f989,Tina Key,2,2026-03-30 06:41:01,"belanja pakai voucher sekarang bhk lah kecewa ny barang gak d kirim ujung2 batal sistem uang kt lh kepending sampai batas d batal sistem, sangat merugikan pembeli",0,,,2026-04-20 20:04:16
com.tokopedia.tkpd,2d9a3b58-386d-41e6-b099-1ba5786acacb,Be Wox,3,2026-03-30 01:45:23,banyak toko langganan pada tutup permanen.....,0,"Halo Toppers, terima kasih atas rating yang kamu berikan. Kami akan terus melakukan perkembangan pada aplikasi Tokopedia untuk terus memberikan keamanan dan kenyamanan Toppers dalam bertransaksi. Silakan sampaikan kritik/saran atau kendala transaksi kamu dengan menghubungi Tokopedia Care melalui tkp.me/supportMainapps.",2025-03-28 18:47:30,2026-04-20 20:04:16
com.tokopedia.tkpd,692942b7-a673-46cb-b71f-6f637da9fe9d,Roony Toni,5,2026-03-30 00:44:38,sangat mudah berbelanja online di sini,0,,,2026-04-20 20:04:16
com.tokopedia.tkpd,4bf89ff0-9c11-490a-9474-24eb4355d957,Deway Cueren,1,2026-03-30 00:20:18,beberapa mingu belakangan ini kecewa berat sm tokopedia krna layanan beli obat jd sulit banget belom lagi loading nya lama bgt.. plis tokped balikan ke seperti sebelum ini.. kita yg bnr2 butuh jd susah mau order 1 obat aja memakan waktu smpe 1/2 jam belum lagi ketika sudah dpt resep gak bisa milih apotik.. jd yg disediakan aja oleh tokped menurut saya ga adil buat konsumen jd ga bisa pilih harga yang sesuai dgn kebutuhan..,0,,,2026-04-20 20:04:16
com.tokopedia.tkpd,113f6a76-8d0a-43bc-ba83-ef542e3780e4,Lucky Edwien69,5,2026-03-30 00:13:56,"Kerenn, Nemu apa yang ku cari👏👏👏👏👏",0,,,2026-04-20 20:04:16
com.tokopedia.tkpd,dc846192-3c30-44d3-9e50-6cc0423320c0,Sobirin Setiyo,5,2026-03-29 23:54:19,semoga anda aplikasi masa depan saya,0,,,2026-04-20 20:04:16
com.tokopedia.tkpd,e94ccf84-09f9-41de-b4d9-bfcb2b61bc41,Ahmad Ahmad noor,5,2026-03-29 23:31:11,pembayaran mudah promo barang dan ongkir sangat memuaskan,0,,,2026-04-20 20:04:16
com.tokopedia.tkpd,ab7dc827-2ce5-451d-9938-cdedb7442997,Rini Mauldy,4,2026-03-29 23:26:37,gabisa pengembalian barang kalo udah ke klik selesai.,0,,,2026-04-20 20:04:16
com.tokopedia.tkpd,463b55b9-2260-42e4-922f-5e97cf5f8800,Defani Aurezta,1,2026-03-29 23:11:12,bisa lebih cepet ga sih proses refundnya? bikin kesel deh dananya jadi ketahan,0,,,2026-04-20 20:04:16
com.tokopedia.tkpd,9c205552-f4e5-4258-92f4-c524d1d181ba,Kusmi Gutomo,4,2026-03-29 23:01:39,"Sejak ada campur tangan Tik Tok, aplikasi ini jadi kurang menarik. Navigasi menu dibeberapa sisi jadi lebih membingungkan. lebih minim cash back dan program promo yang kebanyakan syarat. Biaya layanan juga kelihatan lebih mahal. yang masih jadi lebih plus hanya waktu pengiriman yang rata-rata sedikit lebih cepat dari toko sebelah.",1,,,2026-04-20 20:04:16
com.tokopedia.tkpd,8b531b32-b450-4919-8bf4-a43507c6c6df,Bhondbhond King,1,2026-03-29 22:25:34,kecewa karena tidak bisa melindungi hak pelanggan,0,,,2026-04-20 20:04:16
com.tokopedia.tkpd,5fafef8d-0552-4b2a-b6cf-bb719ececcba,KHAJI PANTURA,5,2026-03-29 22:19:39,puas banget,0,,,2026-04-20 20:04:16
com.tokopedia.tkpd,6b2ab2cd-40e6-4bef-8a17-c66afe0ee189,Ashfirayhani Lamia,5,2026-03-29 22:13:43,lebih proses cepat tranasaksinya,0,,,2026-04-20 20:04:16
com.tokopedia.tkpd,7efbc7c9-ca28-4e9a-90aa-677a6e075804,Imron Rosada,1,2026-03-29 22:03:25,lain kali jadi cs yang bener lah....bukanya mempermudah malah bikin pening kepala,0,,,2026-04-20 20:04:16
com.tokopedia.tkpd,72e50149-acdc-452a-9b8a-8220b7cc67ce,mukti aliraja,5,2026-03-29 21:37:16,good maret,0,,,2026-04-20 20:04:16
com.tokopedia.tkpd,b17f7c02-18d1-4a77-a676-93a5601dbafc,Edo Subianto,1,2026-03-29 19:46:28,"beli obat udah pake resep dokter by sistem tpi apotik nya dipilihkan, gmn sih? monopoli apa gmn, klo dipilihkan yg terdekat sama aja jarak nya 40 km, harus pake kurir reguler. aneh",0,,,2026-04-20 20:04:16
com.tokopedia.tkpd,bfe2d875-966e-4f3e-82ea-aa448b263ebb,Riansyah RAN,1,2026-03-29 19:23:16,tidak bagus bagi penjual pemula,0,,,2026-04-20 20:04:16
com.tokopedia.tkpd,1edc2909-973a-419d-8c39-c87823c442e6,Anton Axl,5,2026-03-29 19:05:29,"bagus byk harga promo slalu ada , mksih tokped sukses slalu",0,,,2026-04-20 20:04:16
com.tokopedia.tkpd,c586a4d1-9be2-4cbc-b5a8-c902908a0c70,Nur Cahyadi,1,2026-03-29 19:03:33,maf sya kasi Bintang 1 di karnakan di sini tidk sesuai dengan harga promo.1 harga promosi misl nya 32100rb.pas cheout dengan harga ongkir nya bisa di sekitar 24rb/ bahkan lebih.tidk seperti di toko sebelah bisa gratis ongkir KLO ada promosi.menurut sya toko ini masih payah,0,,,2026-04-20 20:04:16
com.tokopedia.tkpd,95838d27-0831-4678-bba9-ab4391a82038,David Cell,1,2026-03-29 18:58:47,"pembelian obat resep diberikan harga termahal jadi tidak dapat memilih harga yg murah,",0,,,2026-04-20 20:04:16
com.tokopedia.tkpd,a8330cac-9c4e-479c-b8cd-56819870381d,isni rochman,3,2026-03-29 18:47:14,"sekarang pengen belanja di tokopedia agak mikir2. bener kadang ada promo diskon. tapi kendalanya ongkos kirim mahal. misal barang seharga 22 ribu, ongkos 26 ribu. padahal dulu saya suka belanja kebutuhan rumah disini. makasih, smoga dapat notice",0,"Terima kasih sudah mempercayakan Tokopedia sebagai tempat bertransaksi online pilihan Toppers. Jika ada kritik/saran, atau kendala pada aplikasi Tokopedia, silakan hubungi Tokopedia Care melalui http://tokopedia.com/help ya. Yuk transaksi lagi karena semua Ada dan Bisa di Tokopedia!",2025-03-10 14:47:08,2026-04-20 20:04:16
com.tokopedia.tkpd,309d1373-acd5-4ca1-8c35-b7c51087b1d1,Muhammad Arjuna Dwinanda,3,2026-03-29 18:22:17,emng kurirnya kalau ngantar gaada hub penerimanya dlu ya padahal udah bayar dlu loh. padahal kan bisa hub sebentar,0,,,2026-04-20 20:04:16
com.tokopedia.tkpd,40b8ad4d-f6d2-4ad5-8d8c-20bd3edf7a37,Tom Arbellchess,4,2026-03-29 18:04:41,mau baca semua ulasan toko gak bisa...,0,,,2026-04-20 20:04:16
com.tokopedia.tkpd,109872e7-9ed0-4daa-b060-c9cc033b227b,Rian Sugiantto,4,2026-03-29 17:42:44,ok lah untuk sekarang,0,,,2026-04-20 20:04:16
com.tokopedia.tkpd,0cf4b9e5-7dc3-41d3-9cf7-67dcd7371ac9,Wasisto Ruswidiono,4,2026-03-29 17:18:19,"chat penjual tidak terbaca, sistem eror",0,,,2026-04-20 20:04:16
com.tokopedia.tkpd,ed8c9310-d934-4613-959e-d719b8c15aa9,Sofwan Bolang,5,2026-03-29 16:48:50,rekomendasi,0,,,2026-04-20 20:04:16
com.tokopedia.tkpd,71f7b4d8-442c-4703-b39d-880362575fc9,dhan dhe,5,2026-03-29 16:16:54,👍🏻 🤝🏻 😊,0,,,2026-04-20 20:04:16
com.tokopedia.tkpd,6a2b954f-2bb7-46cc-9b90-8f997ab508ec,SodikinkidulRojikin SodikinkidulRojikin,1,2026-03-29 15:03:36,cukup buruk dalam pengiriman nya,0,,,2026-04-20 20:04:16
com.tokopedia.tkpd,480777a3-c95b-44e6-8e45-53b7c6fea84b,Muhammad Fathur Rizki,1,2026-03-29 14:14:53,"serasa dibodoh bodohi oleh penyedia layanan, ongkir diluar akal sehat,",4,"Hai Kak Fathur, Terima kasih review-nya ya. Kami akan selalu berinovasi untuk dapat menyediakan layanan dan fitur yang lebih baik bagi seluruh pengguna. Besar harapan kami untuk tetap terus bertumbuh bersama Kakak dan menjadi tempat bertransaksi online kepercayaan Kakak. -IL",2021-10-15 09:55:25,2026-04-20 20:04:16
com.tokopedia.tkpd,7f864833-08cf-4306-a787-08ddf45912dd,Shohibun Najah,1,2026-03-29 13:40:36,Toko online macam apa ini...ngk konsisten..ya pasti kalah jauh dengan toko online sebelah kalau jelek dan tidak membantu konsumen nya kalau bermasalah begitu,0,,,2026-04-20 20:04:16
com.tokopedia.tkpd,e71c3097-bf2e-4a9e-8a4f-c47b79c4dda9,aji ajjah,5,2026-03-29 13:22:50,"saya senang belanja di tokopedia karna,harga barang nya lebih murah dan komplit plus ada gratis ongkir dan juga bisa COD.makasih tokopedia.",0,,,2026-04-20 20:04:16
com.tokopedia.tkpd,9138a4fe-134f-43eb-97d1-82dadf7f0984,Banana Like,1,2026-03-29 13:17:35,"ngecairin saldo lama banget, padahal lagi butuh cepat, pantes kalah saing ama e-commerce lain wkwkw",0,,,2026-04-20 20:04:16
com.tokopedia.tkpd,093b3cb9-27db-421e-bc03-d52fd23212af,XFOUR GAMI,1,2026-03-29 12:58:17,"barang yg dibatalkan otomatis kenapa pas refund nya tidak semua, saya hanya menerima sebagian... sangat rugi, sangat kecewa ,",0,,,2026-04-20 20:04:16
com.tokopedia.tkpd,ec2cf8af-22c9-483d-90e7-33e5a37b4a23,Paijo Jowo,5,2026-03-29 12:54:08,"semoga tokopedia semakin terdepan,. sekedar saran, klo bisa pengiriman bisa tepat waktu. saya sering terlambat dtg barangnya...",0,,,2026-04-20 20:04:16
com.tokopedia.tkpd,ab98881a-94ac-431d-8c99-ba23d203f227,aTOz,1,2026-03-29 12:52:53,login error...,0,,,2026-04-20 20:04:16
com.tokopedia.tkpd,073bfb88-baf8-4b2b-8cb8-f308e4ac7d01,Dipa gaming anjai,4,2026-03-29 12:39:54,pengiriman nya lama banget ongkirnya Mana mahal bet,0,,,2026-04-20 20:04:16
com.tokopedia.tkpd,a3ac26a5-8f15-453b-8ad1-35b931da4b33,Rendi abdurahman,1,2026-03-29 12:33:09,pengiriman lelet Masih pengiriman di megahub gateway padahal estimasi tiba 29-30 Maret tapi belum ada update lagi atau informasi,0,,,2026-04-20 20:04:16
com.tokopedia.tkpd,25b093fd-7eeb-401e-bafa-22c03de1522f,Slot Gacor,1,2026-03-29 11:21:54,"ini aplikasi kalok rusak ga usah di kembangkan, jaringan lancar, ngeleg bet, lagi lagi error koneksi internet, paan shopee aja ga gitu, aplikasi rongsok.",0,,,2026-04-20 20:04:16
com.tokopedia.tkpd,db3f0600-3261-4811-9a51-2edfac04e1e8,WIFI GERATISSAN,1,2026-03-29 11:20:43,aplikasi parah,0,,,2026-04-20 20:04:16
com.tokopedia.tkpd,ac7f03bd-4c43-411a-95ff-1327af5558dc,BINTANG PUTRA EKA PRASETYA,5,2026-03-29 11:19:03,Aplikasinya Bagus paket pesanannya Datang,0,,,2026-04-20 20:04:16
com.tokopedia.tkpd,ecc3708e-cdb3-4017-9792-bb17bfcfc744,Adi permana,5,2026-03-29 11:11:50,enak jadi affiliate gampang dapat duit di sini,0,,,2026-04-20 20:04:16
com.tokopedia.tkpd,df198d7e-e9a5-48d4-8657-ea18b67a344c,Official 86,5,2026-03-29 10:57:40,oke baik..,0,,,2026-04-20 20:04:16
com.tokopedia.tkpd,5c434ef0-ba3e-42a1-abc5-ff4411926efd,Burhan Pamekas Jati,5,2026-03-29 10:43:44,Mudah dam cepat,0,,,2026-04-20 20:04:16
com.tokopedia.tkpd,1e75f9b5-b044-4100-bc0b-6f87d8a1a552,Tira Ningrum,5,2026-03-29 10:14:37,Alhamdulillah terkirim tepat waktunya,0,,,2026-04-20 20:04:16
com.tokopedia.tkpd,18683a00-58e8-465d-8245-816bd41ce623,Helena Gaspersz,5,2026-03-29 09:40:39,Mantul,0,,,2026-04-20 20:04:16
com.tokopedia.tkpd,794a7f38-2a34-44ef-8ef3-511b69d32dd7,Dimas ANPScsFrx25,1,2026-03-29 09:38:09,"penarikan saldo lama banget, udah gitu gagal pula, Ribet bener",0,,,2026-04-20 20:04:16
com.tokopedia.tkpd,8f54790e-43e7-403e-96f7-e4916a3f47cd,Bagas Alamsyah,3,2026-03-29 09:35:38,saldo refund saya lama proses nya tidak segera di cairkan,0,,,2026-04-20 20:04:16
com.tokopedia.tkpd,9f38ffc2-e7d6-4680-af16-d688eb42aee5,Aji Bayu,1,2026-03-29 09:01:05,"sering gangguan rumah tokped sekarang dah tidak seperti dahulu , ketipu 1x di sini sampe ngurus ke kantor tokped Semarang",0,,,2026-04-20 20:04:16
com.tokopedia.tkpd,2a994c10-76e5-4eec-9be1-dffd7f654100,Moch Iksan,2,2026-03-29 08:55:01,"voucher potongan dan gratis ongkir tidak kembali meskipun pesanan dibatalkan beda dengan ecommerce sebelah, yg voucher pasti kembali jika pesanam dibatalkan",0,,,2026-04-20 20:04:16
com.tokopedia.tkpd,86fe1c51-2373-4203-a0eb-2580a8a1f575,Xio Bao bao,5,2026-03-29 08:22:01,"Semoga apa ditanyakan dan dicari bisa didapat disini dan dapat terjangkau harganya, Ojie Jakpust.",1,,,2026-04-20 20:04:16
com.tokopedia.tkpd,6e9dd4d6-562d-4ee5-995a-3065aa7c0c5f,Angga Kuswanto,1,2026-03-29 08:20:46,"tokped tdk ada free ongkir, harga bersaing dengan ongkir. diskon dr tokped seperti hantu hari ini ada besok sdh hillang",0,,,2026-04-20 20:04:16
com.tokopedia.tkpd,1ec5a422-830f-4b59-865a-d33254ebe556,Rhoedhiesztha,1,2026-03-29 06:20:42,yang saya rasakan saat ini: gratis ongkir. × diskon harian. × bebas biaya layanan × serasa hina banget sebagai member PLUS anda...,0,,,2026-04-20 20:04:16
com.tokopedia.tkpd,683edb86-6365-415c-bc5f-29cf02dd6d44,Syarif Hidayatullah,1,2026-03-29 05:50:33,tidak bisa menyelesaikan masalah log-in saya...,0,,,2026-04-20 20:04:16
com.tokopedia.tkpd,d86cd0e3-54ae-460e-9886-f06a9d06f97a,Abdul Rokhim,1,2026-03-29 05:44:54,oke baik,0,,,2026-04-20 20:04:16
com.tokopedia.tkpd,cb5b5b1d-8dab-4534-bf6a-9a8b7a9b7898,Tri D.,2,2026-03-29 04:43:25,"beli obat ribet, gak seperti dulu. dulu pilih produk baru chat dokter dan bisa beli produk yang dipilih. sekarang chat dokter dulu dan itu pun bukan produk yang kita pilih. Ribet lu",6,"Halo Toppers, terima kasih atas rating yang kamu berikan. Kami akan terus melakukan perkembangan pada aplikasi Tokopedia untuk terus memberikan keamanan dan kenyamanan Toppers dalam bertransaksi.Silakan sampaikan kritik/saran atau kendala transaksi kamu dengan menghubungi Tokopedia Care melalui tkp.me/supportMainapps.",2024-05-27 19:40:05,2026-04-20 20:04:16
com.tokopedia.tkpd,f82302d6-c24c-4af9-81ac-1f6b0e270a9d,FareL PaSaN,5,2026-03-29 04:08:48,Banyak ikaln ganggu,0,"Terima kasih atas penilaian yang kamu berikan. Besar harapan kami kamu bisa memberikan rating dan review yang lebih baik lagi. Tokopedia akan senantiasa berusaha untuk memberikan pelayanan dan pengalaman terbaik bagi seluruh pengguna. Kalau ada kritik, saran atau kendala di Tokopedia, jangan ragu untuk menghubungi Tokopedia care ya, Toppers.",2022-02-22 21:45:18,2026-04-20 20:04:16
com.tokopedia.tkpd,5a4265c9-48b3-4f0c-9468-c92f3c39fc4d,hendra gunawan,5,2026-03-29 03:05:29,proses cepat & tidak ribet.,0,,,2026-04-20 20:04:16
com.tokopedia.tkpd,dd16de37-133f-4f47-bf93-156a5cd3ff1f,Didin Saripudin,1,2026-03-29 02:26:42,"Tokopedia sering eror ketika saya ketik pencarian lalu saya klik maka langsung eror gak kebuka pencariannya. saya jd kecewa dan akhirnya Tokopedia jd sangat jarang sekali saya buka, sebab saya kecewa dengan pencarian nya yg suka eror gak kebuka",0,"Terima kasih sudah mempercayakan Tokopedia sebagai tempat bertransaksi online pilihan Toppers. Jika ada kritik/saran, atau kendala pada aplikasi Tokopedia, silakan hubungi Tokopedia Care melalui http://tokopedia.com/help ya. Yuk transaksi lagi karena semua Ada dan Bisa di Tokopedia!",2024-10-23 21:03:03,2026-04-20 20:04:16
com.tokopedia.tkpd,ce63cc90-8e6a-4e94-8d32-a3dd29d0855a,Ida Purnama,5,2026-03-29 02:07:59,banyak diskon barang 🅑🅐🅖🅤🅢,0,,,2026-04-20 20:04:16
com.tokopedia.tkpd,60352267-a209-4ba8-808d-1a5505d86457,satrio elek,1,2026-03-29 01:56:19,"greget sama ni aplikasi baru pakai dah dibikin males mau checkout barang pakai promo pengguna baru error mulu transaksi gagal kaga ada penjelasan karna apa,cs juga respon gajelas tolong dah ini klo ga niat ngasih diskon gausah sok",0,,,2026-04-20 20:04:16
com.tokopedia.tkpd,f26bb664-0d9e-4978-9029-7fcc00a1b568,Sugeng Raharjo,1,2026-03-29 00:22:56,aplikasi paya q salh pilih produk GK bisa d batalkan,0,,,2026-04-20 20:04:16
com.tokopedia.tkpd,04c61bd2-363b-493c-adc3-efad9e0405bb,MR Z,3,2026-03-28 23:37:34,"sering lag, gabisa blokir pengguna lain, mempersulit untuk menghindari chat spam promo",0,,,2026-04-20 20:04:16
com.tokopedia.tkpd,73f3f5e5-6713-4e44-ade2-c607237750e5,Dasim Awang,4,2026-03-28 23:17:26,kasih 4 dulu,0,,,2026-04-20 20:04:16
com.tokopedia.tkpd,baf430f4-9eb1-487e-8606-74f36b56989a,Ahmadefendi Efendi,5,2026-03-28 23:14:05,dpt diskon y gede bgttt,0,,,2026-04-20 20:04:16
com.tokopedia.tkpd,70020082-f862-4cca-99db-d1ff85fb4356,nadya rhdtlsya,1,2026-03-28 22:53:15,gajelas selalu gagal pickup setiap beli,0,,,2026-04-20 20:04:16
com.tokopedia.tkpd,5169a6df-bf11-4509-b703-2cb730ee0835,Wahyu Teguh Wibowo,1,2026-03-28 22:37:44,Sangat mengecewakan,0,,,2026-04-20 20:04:16
com.tokopedia.tkpd,a4cab363-1c64-46c4-bbe7-e60d22d40dcc,Taufik Hidayat,5,2026-03-28 22:29:16,bagus sesuai pesanan,0,,,2026-04-20 20:04:16
com.tokopedia.tkpd,a048e5de-57f1-471f-9ab4-a00c35fbdf47,Kuswandi,4,2026-03-28 22:03:37,ada yg aneh sama aplikasi ini masa estimasi tiba 6 hari udah 3 hari pesanan diproses terus ga di kirim kirim,0,,,2026-04-20 20:04:16
com.tokopedia.tkpd,be5f8ec8-be61-493a-acfd-cf3c18f34621,SUMI RAH,5,2026-03-28 21:46:26,ok. bagus,0,,,2026-04-20 20:04:16
com.tokopedia.tkpd,536d667c-fced-44b3-a73b-0a95ffe05ef9,Farhan Firmansyah,5,2026-03-28 21:14:05,Memudahkan bisa pembayaran menggunakan DANA,0,,,2026-04-20 20:04:16
com.tokopedia.tkpd,27b1a43d-fdc6-4a55-9550-ffa61ec826e1,IFO DIGGER,1,2026-03-28 21:08:39,HANCUR,0,,,2026-04-20 20:04:16
com.tokopedia.tkpd,6e6efd5d-06cd-4c49-809b-da226d191a46,julpey,1,2026-03-28 20:21:29,"apk gj lagi maen epep di spam notif tll, asal lagi ga main malah gada notif lawak ajg",0,,,2026-04-20 20:04:16
com.tokopedia.tkpd,3f11af0f-a785-43ee-b4ac-5ed98700eaba,aiifakhry,1,2026-03-28 20:01:59,"percuma langganan plus, ada kendala juga yang katanya prioritas tp tanpa solusi.",6,,,2026-04-20 20:04:16
com.tokopedia.tkpd,49861eb2-a4a4-4b40-a6b1-ca700f510ded,Mikail Lail,5,2026-03-28 19:46:07,ÀPLIKASI ini sangat membantu kita untuk belanja,0,,,2026-04-20 20:04:16
com.tokopedia.tkpd,a188f11a-6cec-4e1f-a519-c823cfe9e19e,Lalu Abdurrahman,2,2026-03-28 19:30:39,ongkirnya terlalu mahal,0,,,2026-04-20 20:04:16
com.tokopedia.tkpd,e587377d-26b9-421b-8de9-7e2985618fa4,M.ZAINUL AZHARI,5,2026-03-28 18:50:41,refund dan pembatalan gak ribet kayak sh**ee,0,,,2026-04-20 20:04:16
com.tokopedia.tkpd,857c1ec6-295e-4584-adb0-4bcd83ccf893,Edy Purnomo,3,2026-03-28 18:49:04,dari sekian banyak saya chat toko untuk tanyakan kesediaan barang tapi tidak pernah dibalas (baru 1 yang balas). memangnya kita ini mau jual beli tidak bisa tanya barang yang mau dibeli kah?,0,,,2026-04-20 20:04:16
com.tokopedia.tkpd,39230bb6-86a1-4ba8-9b1a-0e92e4074004,Stevanus Basuki,4,2026-03-28 18:09:23,Bagus dan aku suka sangat suka,0,,,2026-04-20 20:04:16
com.tokopedia.tkpd,5a30a7e1-21ea-4c61-8660-af9027e5214c,Didit Adianto 93,5,2026-03-28 17:54:41,bagus selalu belanja di aplikasi,0,,,2026-04-20 20:04:16
com.tokopedia.tkpd,389cee17-7804-4c38-a860-1d80ab1f489c,Artha Widhi,3,2026-03-28 17:10:35,"makin kacau. tagihan gopaylater sulit dicari. sengaja biar lupa? lalu banyak tampilan yang makin tidak karuan. apalagi bagian promo dan tampilan ""paylater, bayar"".",0,,,2026-04-20 20:04:16
com.tokopedia.tkpd,ccef1b53-babe-45df-99a6-8157c7faf96f,hudha_ wkwkwk,1,2026-03-28 16:54:30,aplikasi suka error tidak ada perbaikan sama sekali,0,,,2026-04-20 20:04:16
com.tokopedia.tkpd,9b748b51-78e7-46b3-8e22-36fa36702495,Ryu Watanabe88,1,2026-03-28 16:26:50,"makin jelek Tokopedia, mau beli obat dibikin semakin ribet,ga bisa co dari pembelian sebelumnya yg sudah pernah dan pasti harga obatnya,giliran sekarang harus ikut resep dokter,mana harga obatnya ga ngotak lagi,dari yg biasa saya pilih cuma 100 ribu kurang,, lah ini sampai 400 an ribu",3,,,2026-04-20 20:04:16
com.tokopedia.tkpd,e8110967-7029-4f32-8682-e8c5d0ea1ce5,Urifah Trianti,3,2026-03-28 16:21:59,"pembelian obat saat ini harus chat dokter, obatnya resep dari dokter spesialis. dokter dr tokped dokter umum. terusssss gabisa milih obat dr toko yang kita mau, diarahinnya ke apotek yang harganya ga affordable.",0,,,2026-04-20 20:04:16
com.tokopedia.tkpd,c77040a0-c55e-4d89-ba30-4e15bfa37bcc,Nizar Rahman,1,2026-03-28 16:17:11,"akhir2 ini tokped banyak mengecewakan, pesan same day bahkan instant tetap aja datangnya 1 hari lewat. kita ngk butuh diganti sama poin2 hiburan, kita butuh yg cepet.",0,,,2026-04-20 20:04:16
com.tokopedia.tkpd,9f5eb3df-5a0c-4c9d-bb98-ac54e2a27309,Yusuf Hadiz,1,2026-03-28 16:12:20,sistem pencarian sering error teruuus kecewa padahal sinyal stabil,0,,,2026-04-20 20:04:16
com.tokopedia.tkpd,dd935b9e-85d8-4a00-8f11-f1d67518378f,Joko Waluyo,5,2026-03-28 15:41:07,pelayanan sangat memuaskan.cepat dan tanggap,0,,,2026-04-20 20:04:16
com.tokopedia.tkpd,969cdd20-5f77-43a6-a967-741ba49a660e,Novrie Fans,1,2026-03-28 15:34:33,akun saya di hack. pengamananya kurang. dan admin malah dukung simaling buat tutup akun saya. Untung masih ada shoppe,0,,,2026-04-20 20:04:16
com.tokopedia.tkpd,5fe5fe8d-5716-4fa8-9ecd-69a8a62447af,Yo Hungkul,5,2026-03-28 15:31:50,"mudah dan hemat,,",0,,,2026-04-20 20:04:16
com.tokopedia.tkpd,c599d4c0-022b-4796-b13b-110e8ca1566e,SEMBODO BUDI NUGROHO,5,2026-03-28 15:19:04,"Walau hujan tetap antar pesanan, semoga sehat dan sukses selalu. Terimakasih.",0,,,2026-04-20 20:04:16
com.tokopedia.tkpd,e249c72c-e50a-4fd6-b9f1-d95577375b6d,Daffa Hibban,1,2026-03-28 15:14:03,PENGIRIMAN LAMBAT!!!,0,,,2026-04-20 20:04:16
com.tokopedia.tkpd,339f3348-cb0e-42a6-9b6e-9ac69a00a04c,6C / 28 /Yesikha Elisah Budiarto SD TARAKANITA CR,5,2026-03-28 14:47:23,bagus banget langsung bisa terbayar ga lag,0,,,2026-04-20 20:04:16
com.tokopedia.tkpd,0cf6bba1-1508-4ef6-9f86-f50745643ba7,alfi luckym,5,2026-03-28 13:24:28,murce,0,,,2026-04-20 20:04:16
com.tokopedia.tkpd,65ca326c-4dfb-4de9-853b-6fa148a58044,roy bawafih,3,2026-03-28 13:03:40,kenapa sekarang jadi lemot banget yah?,0,,,2026-04-20 20:04:16
com.tokopedia.tkpd,3654a824-81db-45b0-931b-4d0f62fe2d9f,Febri Cm2,5,2026-03-28 12:40:34,sesuai,0,,,2026-04-20 20:04:16
com.tokopedia.tkpd,8a248484-bcc2-4ed7-b60c-71f38e8b063f,Kepin Padilah,2,2026-03-28 11:52:05,"Gila ,baru sekali pake udh raib dari setengah thr saya banyak penipu gk jelas mau lapor kemana terimakasih diskonnya saldo saya langsung kosong.",0,,,2026-04-20 20:04:16
com.tokopedia.tkpd,25e7f3f8-a523-4330-83c5-00f678b44489,Ria Indriyani,5,2026-03-28 11:46:13,lumayan cepat,0,,,2026-04-20 20:04:16
com.tokopedia.tkpd,83e16edd-7ceb-4ec0-8b7b-dfec76764f81,Qurbani Sapto Wahono,2,2026-03-28 11:34:43,"bintang 2 saja saat ini, tahun kemarin bintang 5 saat ini toped sangat sangat sangat lemot dalam membuka aplikasi, pesanan, status pesan bahkan mau bayar saja muter muter lama sekali, saya bandingkan dng aplikasi shopee yg sangat lancar. toped !!! attention ya",6,,,2026-04-20 20:04:16
com.tokopedia.tkpd,b0629631-436e-4318-9ed9-ce2a18c69161,Sella Sella,1,2026-03-28 11:14:30,pengembalian barang ribet banget udah semua bukti di kirim tetep ajah di persulit dan ga bisa di kembalikan..malah membela penjual produk palsu. .dari pada konsumen yang sering belanja jadi males,1,,,2026-04-20 20:04:16
com.tokopedia.tkpd,eee66283-1809-44ae-b7ed-d38cb20dff0b,Rizan skuy,1,2026-03-28 10:38:43,pengiriman lama,0,,,2026-04-20 20:04:16
com.tokopedia.tkpd,d11fb253-0d98-4fc8-8945-e417df521380,mehh nicekleng13,1,2026-03-28 10:23:20,"barang yg kita retur ga sampai ke penjualnya dan uang nya belum di kembalikan, mending beli langsung aja",1,,,2026-04-20 20:04:16
com.tokopedia.tkpd,07b8002f-bc05-4da9-bd30-2066875b74a5,Hasna Hasna,5,2026-03-28 09:01:33,bgus buanget pokonya🥰,0,,,2026-04-20 20:04:16
com.tokopedia.tkpd,08d7c835-f2be-49c4-aa5d-f9de2c1072b1,Adip Aryanto,5,2026-03-28 09:00:21,ok baik,0,,,2026-04-20 20:04:16
com.tokopedia.tkpd,6bd8b3f7-ffae-4b49-a309-d0f46a675c1c,Putri Hawa,1,2026-03-28 08:47:56,"Mau beli obat kategori keras, skrg mesti chat dokter dulu bwt di ksh resep. padahal udh ada resep dr dokter waktu kontrol di RS. tp harus chat dokter dr Tokopedia lg. ya udah gpp lah. mgkn ada bagusnya. yg bikin pasien kesel. tuh apotek/toko yg jual obat tsb, kita gk bs pilih. semua di pilih oleh Tokopedia. yg harganya sangat2 mahal daripada apotek/toko laennya. tolong donk klo untuk toko/apoteknya tuh kita bs bebas pilih. yg penting kita udh konsultasi dokter & punya copy resepnya",11,,,2026-04-20 20:04:16
com.tokopedia.tkpd,a3526908-04b6-4b5b-93c0-9fdc738c5db8,Ozywayne Hattan,1,2026-03-28 07:01:34,aplikasi jelek,0,,,2026-04-20 20:04:16
com.tokopedia.tkpd,e26ae065-d1b8-4688-b24d-160a80c0f7a1,Bonjopy harianja,1,2026-03-28 07:01:01,"saya selaku driver gojek kecewa, setiap dpt orderan tokopedia sering sekali cancel otomatis,..jelas ini merugikan driver dan buyer.",0,,,2026-04-20 20:04:16
com.tokopedia.tkpd,3059e5e0-4683-4d91-8d9e-9d9f59346dab,Rockstar Memes,4,2026-03-28 07:00:45,"Terjadi beberapa bug saat proses pembelian, tidak ada keterangan saat digulir ke bawah pada sesi pembelian. mungkin tambahkan logika baru seperti, jika proses loading terlalu lama maka akan terjadi pembatalan loading. tapi ini mungkin akan terjadi perubahan yang signifikan pada arsitektur aplikasi.",2,,,2026-04-20 20:04:16
com.tokopedia.tkpd,277f6b00-d4c7-477d-b570-611ed6e9d068,Hermanto Toto,5,2026-03-28 06:25:00,nyaman dah,0,,,2026-04-20 20:04:16
com.tokopedia.tkpd,a458413b-f529-42cd-826e-d9cb931a1da7,X YZ,1,2026-03-28 06:13:20,"makin kesini makin parah, udah lemot, sering error, banyak gangguan",3,"Halo Toppers, terima kasih atas rating yang kamu berikan. Kami akan terus melakukan perkembangan pada aplikasi Tokopedia untuk terus memberikan keamanan dan kenyamanan Toppers dalam bertransaksi. Silakan sampaikan kritik/saran atau kendala transaksi kamu dengan menghubungi Tokopedia Care melalui tkp.me/supportMainapps.",2023-09-16 00:10:01,2026-04-20 20:04:16
com.tokopedia.tkpd,29205e6f-dccf-4f56-8795-c7de75ec523a,Ocrit Devita,5,2026-03-28 06:09:33,Good aplikasi,0,,,2026-04-20 20:04:16
com.tokopedia.tkpd,6cd6eb3f-40a1-4cc5-a7d1-3607c1f5500a,Ilyas MA,4,2026-03-28 05:54:52,good lah,0,,,2026-04-20 20:04:16
