app_id,reviewId,userName,score,at,content,thumbsUpCount,replyContent,repliedAt,scraped_at
com.tokopedia.tkpd,708d5de7-498d-401a-b279-01d2cc7cd2c7,Agus Hernanto,5,2026-03-10 22:41:10,sangat membantu pas lg butuh...tks,0,,,2026-04-20 20:04:16
com.tokopedia.tkpd,2c4e0769-3226-4a93-90a0-7cdd18d7e96a,Weather Forecast,1,2026-03-10 22:33:39,force close tiap buka kotak masuk,1,,,2026-04-20 20:04:16
com.tokopedia.tkpd,d5ebc53a-fa78-4f00-bc35-401b67429676,Zenni Priyono,5,2026-03-10 22:08:47,"untuk beli ok, untuk jualan no",0,"Halo Toppers, terima kasih atas rating yang kamu berikan. Kami akan terus melakukan perkembangan pada aplikasi Tokopedia untuk terus memberikan keamanan dan kenyamanan Toppers dalam bertransaksi. Silakan sampaikan kritik/saran atau kendala transaksi kamu dengan menghubungi Tokopedia Care melalui tkp.me/supportMainapps.",2025-02-13 00:47:27,2026-04-20 20:04:16
com.tokopedia.tkpd,60a81ef1-fe2b-4ad6-a6a7-3563568f2d54,Stefanie Halim,1,2026-03-10 22:03:13,harganya tiba2 naik pas pembayaran,0,,,2026-04-20 20:04:16
com.tokopedia.tkpd,38673bd0-c9e8-4cc1-b5d6-a67bd5d6adae,Kama padam Apakah boleh,1,2026-03-10 21:17:36,paansi kn baru pencet pesen trus lagi loading pencet kmbli bntr diskon ny ilang anjr gj,0,,,2026-04-20 20:04:16
com.tokopedia.tkpd,22bf1698-0a74-4cf6-a0a8-489be8375fbe,bahan prem,1,2026-03-10 20:59:30,beli obat sekarang ribet kalo dulu resep dokter bisa di gunakan di toko mana saja sekarang resep dokter harus beli di toko tertentu jadi kadang harga obat normalnya 50rb tapi dipaksa harus beli yg harga 100rb karena tokonya ditentukan langsung Tokopedia,0,,,2026-04-20 20:04:16
com.tokopedia.tkpd,f48983a6-2a6d-45d0-b6ad-6c01946bd7d4,King Artuv,1,2026-03-10 20:58:04,maret 2026 pas puasa kenapa force close terus ini mana ada orderan semoga lekas fix bug tersebut atau hanya karena overload traffic mau lebaran,2,"Hai Toppers, saat ini tim kami sudah melakukan penanganan terkait kendala akses aplikasi hingga versi 2.15.5. Mohon kesediaannya melakukan update aplikasi di versi terbaru 2.15.6 melalui google play. Berikan feedback nya kembali apakah kendala masih muncul atau sudah teratasi dengan baik serta update rating di google play ya.

Terima kasih.
^au",2017-11-23 17:24:59,2026-04-20 20:04:16
com.tokopedia.tkpd,a1761370-0bb4-47e1-9c23-a3d1d1a3a55c,Ida Waty,5,2026-03-10 20:56:25,very good,0,,,2026-04-20 20:04:16
com.tokopedia.tkpd,99d0332b-0549-4354-b524-bb64064f05c7,Muhammad Juana,1,2026-03-10 20:48:17,Jelek banget sih,0,,,2026-04-20 20:04:16
com.tokopedia.tkpd,40a620fe-e760-46d7-948b-488af691edfe,Alfreno Preynza Taloim,5,2026-03-10 20:11:48,bagus aku sangat puas dgn Tokopedia ini,0,,,2026-04-20 20:04:16
com.tokopedia.tkpd,064617b9-5c67-47f6-9ba8-3da5c1812b72,Acw zaa,5,2026-03-10 19:59:52,banyak promo diskon mantapp bangett,0,,,2026-04-20 20:04:16
com.tokopedia.tkpd,d272282d-8f34-4410-8098-d65ec6e21deb,Tamrin Hadi,5,2026-03-10 19:24:15,cepat tanggap.,0,,,2026-04-20 20:04:16
com.tokopedia.tkpd,b019b9f1-2194-4159-ba68-6e8b623cb4c3,rahmat otolomo,3,2026-03-10 19:15:41,"habis di update, gak bisa masuk ke aplikasi, keluar sendiri dari aplikasi, force close. itu kenapa????",1,,,2026-04-20 20:04:16
com.tokopedia.tkpd,cc181de3-dd3c-4c69-8154-a1788f73a989,Doli Saputra,1,2026-03-10 19:06:00,banyak bug please,1,,,2026-04-20 20:04:16
com.tokopedia.tkpd,eca6b8e8-178c-4a14-97f7-19d986bffa2d,G D P TAM Tampubolon (Lo),5,2026-03-10 18:45:11,"aplikasi Tokopedia sdi hp saya ,tid ak bisa dibuka jam 18.43,Selasa 10/30/2026,tolong diperbaiki,tks",1,,,2026-04-20 20:04:16
com.tokopedia.tkpd,504611ec-b6f4-4675-b400-67f05289523a,Nur Mala aziel,1,2026-03-10 18:13:21,sya mau msuk buat akun kn pke kode pas kode ny muncul sya aku ketik kode itu mlah otomatis ngetik sendiri udh mh slah kode ny bneren dong,0,,,2026-04-20 20:04:16
com.tokopedia.tkpd,5f60ff7e-2931-440e-a1b8-f8621cde0f9d,Mimak Mim,1,2026-03-10 18:01:10,proses pengiriman mahal dan lambat,0,,,2026-04-20 20:04:16
com.tokopedia.tkpd,01210f6d-cf51-48ef-b0e8-ebdeb5772048,Dede Karno,3,2026-03-10 17:57:52,pesan di sini bukan nya nyampai malah balik lagi siapa,0,,,2026-04-20 20:04:16
com.tokopedia.tkpd,b2a930d6-3c06-440b-b89b-73354518d04b,Raiza Kazama,1,2026-03-10 17:52:23,"verifikasinya stuck di gopay terus gak bisa lanjut buat scan KTPnya, saran buat tokped mending kalau verivikasi tuh di pisah aja sama nyambungin ke aplikasi lainya, jadinya malah eror kek gini, gak jelas banget",0,,,2026-04-20 20:04:16
com.tokopedia.tkpd,2c5d2086-b4b6-4c5f-9d9e-f05b3c8d8949,arum linka,1,2026-03-10 17:48:40,"marketplace sarang narkoba,beli kalung datang obat malamnya polisi datang,hati2",0,,,2026-04-20 20:04:16
com.tokopedia.tkpd,543921bc-ddc0-4550-a19c-a9349cd3b95b,Noni Lasmini,1,2026-03-10 16:42:38,"apk. ta*, gak bermutu, ngelag/lola Mulu pas mau buka berandanya, -⭐⭐⭐⭐ ,-99%",1,,,2026-04-20 20:04:16
com.tokopedia.tkpd,2df03a7f-0ce4-47b8-a44a-aeccbc309682,Agus Riadi,5,2026-03-10 16:36:06,fast respon,0,,,2026-04-20 20:04:16
com.tokopedia.tkpd,18d36b15-b5c5-4c14-8223-5c93086ed380,yori custom,1,2026-03-10 16:34:01,"Beli barang pakai sameday, tp barang tidak sampai dihari yang sama menggunakan kurir paxel. mestinya proffesional saja ya tokped, jika jasa kurirnya memang tidak bisa menyediakan service barang sampai dihari yang sama. jangan dimasukan ke pilihan kurir yang sameday. sudah bayar ongkir sameday tp service yang diterama seperti pakai reguler pengiriman biasa. Proffesional lah, Nama sudah besar juga. Kalo memang jasa pengiriman tersebut tidak bisa menyediakan. hapus aja service tersebut!",0,,,2026-04-20 20:04:16
com.tokopedia.tkpd,2619f3c1-6e2a-45c0-8873-795b84f07fb6,Rio Budi Purwanto,1,2026-03-10 16:26:16,"dari sekian lama saya pakai jasa Tokopedia ada banya kendala dan kali ini tdk bisa saya tolerir, saya harus angkat suara.. tolong solusi dari toped kalau barang kadang dicancel sepihak alasan gagal pengiriman dan saya sudah nunggu paket sebulan lebih gk nyampe dan saya kaget di aplikasi dinyatakan paket telah tiba di tujuan, gimana ceritanya paket belum ditangan sudah dibilang sudah tiba ditujuan? giliran saya mau tulis pengaduan di aplikasi Tokopedia langsung ngeleg"" dan sering keluar otomatis",10,,,2026-04-20 20:04:16
com.tokopedia.tkpd,c628ac17-0cfd-41a7-8c38-ce08af64a755,Reza Septyan,1,2026-03-10 16:05:55,Makin ampas terutama pada Layanan Customer service.,0,,,2026-04-20 20:04:16
com.tokopedia.tkpd,bfa46a99-2020-4310-ab97-c3c7b0c891f4,Azqiara Zhezan,1,2026-03-10 15:23:15,"jebakan harga, masa mau dibayar harganya langsung mahal",0,,,2026-04-20 20:04:16
com.tokopedia.tkpd,911d1bff-ffdf-49c6-b5f5-ecc057638d68,Jetty Disya,1,2026-03-10 15:10:58,pengiriman apa ini orang ga pernah nolak paket kok dibilang nolak paket,0,,,2026-04-20 20:04:16
com.tokopedia.tkpd,33005e08-3fbe-4f42-90ac-f29bff4ff14a,Freya Shari,1,2026-03-10 15:03:46,"harganya jadi normal, diskonnya buat menarik menarikan aja",0,,,2026-04-20 20:04:16
com.tokopedia.tkpd,4f12eaf2-00bb-4d4a-a94f-1e747caf1a18,ekado fendy,1,2026-03-10 14:36:47,Tolong fitur chat dokter di hilangkan aja... Mau beli obat jadi repot skli... Pilihan apotek langganan malah di arahkan ntah ke apotek mana ga jelas.. Udah itu kosong trus pula,0,,,2026-04-20 20:04:16
com.tokopedia.tkpd,a01785af-0bb5-4daa-b6da-71ea09f3021d,andika putra,1,2026-03-10 14:31:06,pantesan bnyak yang lari ke shopee di sini mahal ongkirnya pun mahal,0,,,2026-04-20 20:04:16
com.tokopedia.tkpd,ad6eb4a8-c34a-4bbd-9592-7bd0055a5a72,Azharianto Latief Baroto (Harry Baroto),1,2026-03-10 14:18:42,aplikasi yg ada pihak ketiga,0,,,2026-04-20 20:04:16
com.tokopedia.tkpd,a1931e27-47b1-4ab3-8ec5-cf0a50037008,DRYLAND 54,5,2026-03-10 13:42:47,banyak voucher diskon👍,0,,,2026-04-20 20:04:16
com.tokopedia.tkpd,a4f7cb75-63a4-493c-9365-9d28aed13006,Slly Krtk,1,2026-03-10 13:25:59,buruk sekali voucher gabisa dipakek ulang ulang trus gak kayak sioren sat set,0,,,2026-04-20 20:04:16
com.tokopedia.tkpd,361a8b93-c423-4fee-a91e-5faf716524e6,Candra Asik,5,2026-03-10 12:54:02,gw download ini cuman buat beli hp impian gw doang jir 😹,0,,,2026-04-20 20:04:16
com.tokopedia.tkpd,37b02640-ba89-45bb-9a15-bb02f4289788,Muhammad Lingga,2,2026-03-10 12:38:40,gaa bisaa belanja selalu gagal,0,,,2026-04-20 20:04:16
com.tokopedia.tkpd,98e0932f-9e39-4bd5-a320-9c90695870fb,Asep Yopi,3,2026-03-10 12:24:42,"aplikasi tidak bisa di buka harus hapus chache dulu sama data,login lagi baru bisa masuk,dan sering force close juga jadi bikin jengkel aplikasi nya,berulang kali seperti itu terus",2,,,2026-04-20 20:04:16
com.tokopedia.tkpd,2fcb9028-7195-44b7-a880-b0b5a67eb36c,Shandy Lesmana,1,2026-03-10 12:00:45,LOGISTIK NGAPAIN PAKE J&T! PAKET DIBAWA MUTER2 SAMPE 3 HARI!,6,"Toppers, mohon maaf atas kendala yang kamu alami. Silakan sampaikan kritik/saran atau kendala transaksi kamu dengan menghubungi Tokopedia Care di tkp.me/supportMainapps untuk dicek lebih lanjut. Kami akan terus meningkatkan performa aplikasi, fitur serta layanan agar bisa memberikan pengalaman bertransaksi yang lebih baik lagi untuk semua pengguna.",2024-02-05 21:40:09,2026-04-20 20:04:16
com.tokopedia.tkpd,de1a1118-f5f8-4bdf-8d4b-50cb1b96a55d,Pramana sari kedelai,5,2026-03-10 11:25:07,"oke banget, aku dapat kupon 500k",0,,,2026-04-20 20:04:16
com.tokopedia.tkpd,116899d7-ac20-4058-8428-4ba5e23b8907,Ahmad zacky Putra pratama,5,2026-03-10 11:08:11,Halo kak kenapa disini gak jual airsoft ya soal nya aku mau (2026:apasih ulasan gw dulu jir😹 dah tau bahaya masih nanya😹),0,"Hi Toppers, terima kasih untuk rating dan ulasan baiknya, ya! Kami akan terus meningkatkan performa aplikasi, fitur serta layanan agar bisa memberikan pengalaman bertransaksi terbaik bagi semua pengguna. Yuk tingkatkan terus transaksi kamu!",2024-05-06 19:40:07,2026-04-20 20:04:16
com.tokopedia.tkpd,ce908341-485b-4ff6-9d98-8bfbdc4cf178,Shanty Andriani,3,2026-03-10 11:03:29,"dulu aku duta toped diantara temen2 yg udah di orens, tapi semenjak berlangganan plus muahalnya minta ampun dan kalo ga kena ongkir yg ajegile dan diskonnya ga seberapa itu aku jadi males..",0,,,2026-04-20 20:04:16
com.tokopedia.tkpd,e1025db5-db2e-4b53-84a3-eb1c50410e8f,Donny Chin,1,2026-03-10 11:00:55,"skrg ribet beli obat tanda merah di toped. kt gak bs pilih toko yg mau kita beli. capek2 chat dokter dikasih resep tp diarahkan ke bbrp toko tp masalahnya harganya mahal2 dan kt tdk bisa chat tokonya tny exp nya kapan jd kyk beli kucing dalam karung .kita gak bs pilih toko yg kita mau dan resep jg gak bs disimpan buat kita pilih toko yg harga lbh murah dan bisa pilih exp yg jauh. resep jg hilang klu keluar dr chat dokter. bahkan mau lihat tokonya pun gak bs, langsung di alihkan ke chat dokter.",0,,,2026-04-20 20:04:16
com.tokopedia.tkpd,6418df86-b613-4ccf-ad48-286ddfadde9c,KETUNGGENG JW,1,2026-03-10 10:48:32,"woi kenapa harus disambungin sama aplikasi tiktok paling benci saya aplikasi tiktok ini mau rubah pengaturan harus disambungin aplikasi tiktok , mending gua gak jadi dari pada harus bikin akun tikok",64,,,2026-04-20 20:04:16
com.tokopedia.tkpd,fd1171ea-24e7-4776-8528-0895612f865e,Gamers Indo,1,2026-03-10 10:32:56,"ongkir aja ngk ada yg free padahal beli di atas 50k 100k lama""byk user hilang dri tokped pindah ke aplikasi sebelah liat aja ntr",0,,,2026-04-20 20:04:16
com.tokopedia.tkpd,720fed5e-b947-4ff8-a20e-121d88130c43,Adamjulianfairus,1,2026-03-10 10:11:57,Aplikasi gaje di minta isi kode pos pas udah saya isi tetep diminta isi kode pos,0,,,2026-04-20 20:04:16
com.tokopedia.tkpd,e5269115-c3a3-479b-9d11-63a8876dfbb9,Edi Budi,5,2026-03-10 09:16:08,"belanja online tercepat, terbaik banyak discount nya 👍",0,,,2026-04-20 20:04:16
com.tokopedia.tkpd,6221e872-63e0-4ac9-bc1f-9f83f5c71e36,Dede Saripudin,5,2026-03-10 07:56:48,gopaya leter mantul,0,,,2026-04-20 20:04:16
com.tokopedia.tkpd,94112414-b598-4a80-8c08-432307939a4c,Oknjsjsn,5,2026-03-10 07:21:59,goood,0,,,2026-04-20 20:04:16
com.tokopedia.tkpd,6da2e753-4b31-432c-96c0-741f907912e0,Ricky Marciano,1,2026-03-10 05:06:29,"SY PENGGUNA BARU, WAKTU MAU TRANSAKSI KOK GAGAL TERUS YA ? KENAPA YA ? PENGALAMAN DI TEMPAT LAIN GAK PERNAH SEPERTI INI..",0,,,2026-04-20 20:04:16
com.tokopedia.tkpd,fd37b887-fd77-4b4f-8ac1-cd7ff0cbe8b2,oliPerkan sitorus,1,2026-03-10 05:02:00,butuk,0,,,2026-04-20 20:04:16
com.tokopedia.tkpd,77dbd9dc-5251-4bf0-9c53-a2152c664172,Lilis Is,5,2026-03-10 04:47:28,sangat membantu kak mksh buanyak,0,,,2026-04-20 20:04:16
com.tokopedia.tkpd,1a617269-d162-4a21-98b1-ca16d9cc56ea,Al Imron,5,2026-03-10 04:41:22,harus sabar menunggu vocer .baru bisa belanja hemat .happy shopping,0,,,2026-04-20 20:04:16
com.tokopedia.tkpd,9f8d75a6-9e23-4ac4-bcb4-d0c98c3e643e,Ardian Larc,1,2026-03-10 04:28:46,udh nggk bisa gopaylater lagi,0,"Terima kasih sudah mempercayakan Tokopedia sebagai tempat bertransaksi online pilihan Toppers. Jika ada kritik/saran, atau kendala pada aplikasi Tokopedia, silakan hubungi Tokopedia Care melalui Tokopedia Care ya. Yuk transaksi lagi karena semua Ada dan Bisa di Tokopedia!",2024-02-07 16:20:04,2026-04-20 20:04:16
com.tokopedia.tkpd,91c265fb-5e24-442e-a1f6-bc9f1fb9dee0,Suswarinah Sunaryo,5,2026-03-10 04:19:05,okeh ...,0,,,2026-04-20 20:04:16
com.tokopedia.tkpd,665c6cdf-63d5-4b2e-b0d0-f0a1cda50cde,BIASAajja Aaakshhs,5,2026-03-10 04:10:47,waw ini aplikasi wajib di kasi bintang 5,0,,,2026-04-20 20:04:16
com.tokopedia.tkpd,2cb18b5b-30dd-45c3-bfd6-7767e40c6590,Omar,1,2026-03-10 04:00:24,sinyal bagus susah masuk..ampassss,0,,,2026-04-20 20:04:16
com.tokopedia.tkpd,0a8b906c-b405-4e6d-b6ee-3120485821a2,Rendi Johana,5,2026-03-10 02:09:57,Saya kasih bintang 5 karena Tokopedia Hebat banget pokonya topmarkotop...👍,0,,,2026-04-20 20:04:16
com.tokopedia.tkpd,9377f75f-dc9e-4301-ac70-eebd516eaced,Aminah Amin,5,2026-03-10 01:48:32,"Lope lope tokped, akhir2 ini vouchernya banyak banget. Please kayak gitu terus wkwkwk😂. saya suka saya suka.",0,,,2026-04-20 20:04:16
com.tokopedia.tkpd,ed0a493e-cd10-44c3-b587-ca9252a30e5a,Khoirul Anas,5,2026-03-10 00:43:01,oke banget deh pokoknya,0,,,2026-04-20 20:04:16
com.tokopedia.tkpd,b1e0671d-6893-47b7-b35e-7e7876f578e6,Royan Abdurrafi,1,2026-03-10 00:31:04,"beresin noh aplikasi lu, masih banyak bugg sampe gua mau bayar cicilan aja gabisa jadi kena denda gua. gara gara jelek nya sistem aplikasi lu!!",1,,,2026-04-20 20:04:16
com.tokopedia.tkpd,b1f82cc9-e26a-469f-88d1-9088d8012f87,Ageng Widodo,5,2026-03-09 23:57:52,sangat menyenangkan,0,,,2026-04-20 20:04:16
com.tokopedia.tkpd,29443b17-c05c-4f35-a674-03d1bdf772bd,Mbah Uti,5,2026-03-09 23:44:42,no cap,0,,,2026-04-20 20:04:16
com.tokopedia.tkpd,adb36b9d-39c4-4ee2-969a-32d21897eb3a,GenZ 11,1,2026-03-09 23:41:47,ongkirnya gangotak aneh pdhal brng kecil gaberat kwkwkwkwk,0,,,2026-04-20 20:04:16
com.tokopedia.tkpd,0055430e-e5e0-4566-a1e2-26d1ae25ac4e,Joko Suro,1,2026-03-09 23:10:12,kasih diskon voucher gede cuma gimmick doang giliran dipake gak bisa gak niat ngasih males dapet 2 kali voucher kejar ketupat gak bisa dipake semua.,0,,,2026-04-20 20:04:16
com.tokopedia.tkpd,f0dd9c5a-9a22-42fd-88f0-ade73442cb0e,Odhoy Sapoetra,1,2026-03-09 22:56:50,dapet bonusan 150rb..mau dipake tapi diatur tokped..ga kaya shoope.dpt bonusan kita yg ngatur mau dipake brp aj..kecewa,8,"Hai Kak Odhoy, maaf atas ketidaknyamanannya. Besar harapan kami untuk bisa terus tumbuh bersama Kakak dan Tokopedia tetap menjadi tempat bertransaksi online kepercayaan Kakak. Serta untuk kendala tersebut bisa bantu laporkan dengan menghubungi kami melalui https://bit.ly/2JbMA0J agar dapat dicek lebih lanjut. Thanks -RI",2020-03-22 11:33:51,2026-04-20 20:04:16
com.tokopedia.tkpd,c570b75c-7264-4a89-b665-5d843b5f2ed7,M. Reihandi Rizal,1,2026-03-09 22:56:02,"Niat kasih promo ngk sih, mending kagak usah sekalian. Aplikasi paling ribet dan gajelas, kalau ngk mau kasih voucher bla bla ya kagak usah sekalian. Mau pesen aja ribet sampai coba ganti semua metode pembayaran sama aja tetap aja kagak bisa. Ini karena tokonya ngak jualan di OREN ogah pake app busuk ini. MENDING KAGAK USAH SOK SOK AN PAKE VOUCHER APALAH. Emang bagusan SHOPEE sihh.",2,,,2026-04-20 20:04:16
com.tokopedia.tkpd,1aede88a-fded-4d6d-adf3-54815b0c0239,drs miswardi,5,2026-03-09 22:52:56,"Alhamdulillah, pakai Tokopedia sangat membantu dan menyenangkan. Terima Kasih Tokopedia. Sukses selalu. Aamiin ....",1,,,2026-04-20 20:04:16
com.tokopedia.tkpd,78af6d10-e8ed-4a53-ab21-a537144254f3,A_3to tea,5,2026-03-09 22:45:14,aplikasi respon cepat,0,,,2026-04-20 20:04:16
com.tokopedia.tkpd,ed491efb-043c-493b-9fd4-ef451a704f00,Rahmad Hidayat,5,2026-03-09 22:32:27,buruan belanja online lebih mudah dan praktis,0,,,2026-04-20 20:04:16
com.tokopedia.tkpd,eac4863c-447c-4a27-8356-9dd7123196fb,Tommy Raharja,3,2026-03-09 22:20:40,kok akhir2 ini crash terus ya?,1,,,2026-04-20 20:04:16
com.tokopedia.tkpd,d4cbeef7-128c-42a1-af67-e41aded57f01,Hadi Septiansyah,5,2026-03-09 21:57:36,okelah,0,,,2026-04-20 20:04:16
com.tokopedia.tkpd,5cea1a40-789c-403b-ae9b-9c16d2c24476,Sety Awan,5,2026-03-09 21:57:02,sangat mudah digunakan,0,,,2026-04-20 20:04:16
com.tokopedia.tkpd,359f723a-c64c-41d9-b402-bef6ebe3f840,Agung Kurniawan,3,2026-03-09 21:42:51,"semakin kemari semakin banyak bugnya,sering tiba tiba keluar sendiri.Perbaiki dong,mana developer nya nih",3,,,2026-04-20 20:04:16
com.tokopedia.tkpd,128226dd-7595-4249-b119-cab63a5d3098,Ali,1,2026-03-09 21:14:51,"Penukaran Cashback dibatasi jadi males Menggunakan Tokopedia Padahal dari 2022 Nyaman nyaman aja,, entah kenapa Sekarang Kebijakannya makin tidak nyaman Kalo Tidak Plus Ongkir mahal banget Terpaksa saya Uninstall",1,,,2026-04-20 20:04:16
com.tokopedia.tkpd,519f83c5-57b1-432d-9db3-a8bb3c268f34,Andi Boy,1,2026-03-09 21:06:54,terlalu banyak muncul iklan,0,,,2026-04-20 20:04:16
com.tokopedia.tkpd,eb2357d8-de63-44b6-b0ea-b4bc0d6ee5b7,nara daftly,1,2026-03-09 21:03:25,aplikasi gk jelas. seller juga gk jelas. parahnya cs nya pun gk jelas. tiap ada event eror mulu. gk rekomen buat di download,2,,,2026-04-20 20:04:16
com.tokopedia.tkpd,a34fdd39-feed-4f5a-8a63-048bab206cf6,Petu Paonganan,5,2026-03-09 20:31:54,"sangat mudah dalam berbelanja, banyak diskon dan potongan harga",0,,,2026-04-20 20:04:16
com.tokopedia.tkpd,f82ba01c-abd8-49fa-963a-9a42ea0cc7c4,maylaffeisha,5,2026-03-09 20:29:24,ilove u tokped,0,,,2026-04-20 20:04:16
com.tokopedia.tkpd,d19fbe21-ab88-40db-af8b-a9d1984e4ef4,aris firman,1,2026-03-09 20:15:31,aplikasi gak niat,0,,,2026-04-20 20:04:16
com.tokopedia.tkpd,68313c2b-4bbd-4297-9e7d-708545940ec9,Yuu,1,2026-03-09 20:08:59,"diskon 100ribu mau di klaim malah eror, udah 3 kali anjir",0,,,2026-04-20 20:04:16
com.tokopedia.tkpd,c0ef5ca1-f90a-4a6b-91a6-b5d9d37fd6db,Untung Yanuar,1,2026-03-09 20:06:58,"Jelek banget promo kejar ketupat. Jam 20.00 klik klaim gagal terus. Gak niat promonya, wkwkwkwkwk",3,,,2026-04-20 20:04:16
com.tokopedia.tkpd,b4ea1c45-b55f-4786-a393-071abc45741f,Mansyur,1,2026-03-09 20:05:10,"penipuan, promo curang sudah di pencet malah ada tulisan ada kendala jadi ga dapat voucher deh",2,,,2026-04-20 20:04:16
com.tokopedia.tkpd,eef97a34-61cd-4b0d-b6c3-8904c7e741b8,Safrudin Sam,5,2026-03-09 19:58:44,sangat bagus semua produk terjamin kualitasnya,0,,,2026-04-20 20:04:16
com.tokopedia.tkpd,d3605c6a-2851-4249-8b21-80639e445ef4,Entir Sutirah,5,2026-03-09 19:57:26,Alhamdulillah saya suka blanja di Tokopedia barang nya bgs ga ngecewain,0,,,2026-04-20 20:04:16
com.tokopedia.tkpd,65db7a2e-47ff-43f9-8582-cb6151452e39,De Pe,5,2026-03-09 19:56:45,karna kolab sama tiktok harusnya lebih banyakin diskonnya,0,,,2026-04-20 20:04:16
com.tokopedia.tkpd,f85b0f99-6295-4db3-8aa0-085feee394f1,Ngurah Kawan,5,2026-03-09 19:48:17,producknya bagus- bagus,0,,,2026-04-20 20:04:16
com.tokopedia.tkpd,9ecb4f32-9fc2-4d63-959f-311d2d724d6a,Freedom Solossa,3,2026-03-09 19:28:15,"ada apa dengan tokopedia? saya udah pakai tokopedia dari sejak 2016, dan dulu aplikasinya yang terbaik dari antara sekian banyak aplikasi olshop di indo. sekarang untuk pencariannya tidak sebaik dulu lagi. pencarian berdasarkan kategori tidak bisa sedetail dulu lagi. cenderung berat dan banyak bugnya. makin update malah makin berat. aneh.",7,,,2026-04-20 20:04:16
com.tokopedia.tkpd,44a1c5b3-eb38-48e0-be42-997b1a8e2db8,Cornelius Marsianus,5,2026-03-09 19:20:33,oke banget,0,,,2026-04-20 20:04:16
com.tokopedia.tkpd,c48aa438-0512-4b6b-b74f-c70bbdbe1898,Angga Andreyansyah,5,2026-03-09 19:19:05,bagusss buat shopingg,0,,,2026-04-20 20:04:16
com.tokopedia.tkpd,9d236e75-58f0-4a50-8cd0-68beb41cef9f,Yusup Pandu Putra Wibowo,2,2026-03-09 19:08:40,Kurang Membantu,0,,,2026-04-20 20:04:16
com.tokopedia.tkpd,7022a804-43c7-43b4-a7d0-219a511e0ce3,Made Jayadi,1,2026-03-09 19:07:01,nomor HP wajib 15 digit,0,,,2026-04-20 20:04:16
com.tokopedia.tkpd,af9eed41-0ada-47b9-a842-504d1782410a,Hani Fitriany,2,2026-03-09 18:48:58,Ini layanan pembelian tiket kereta api/KAI sudah ga ada ya cs?!,0,,,2026-04-20 20:04:16
com.tokopedia.tkpd,a1c1de72-0e30-41d5-9b3b-ce3b4044f796,Zora Bintang,5,2026-03-09 17:53:06,"pengembalian barang nya banyak potongan contoh seprti saya, membeli barang X seharga 54000 kembali cuma 23000,jangan donwload gaiys, kalo bisa saya laporin ya laporin, tulisanya pengembalian gratis tapi pas di retur banyak potongan",1,,,2026-04-20 20:04:16
com.tokopedia.tkpd,02a69d37-bc9f-49d9-a33c-e47149dde2a5,Dasvin Junior,3,2026-03-09 17:37:31,sya kurang puas dengan kinerja instan ....butuh hari ini malah GK di kirim. pihak aplikasi kurang respon terhadap instan. tolong perhatikan bagian driver biar bisa ngangkut orderan.☝️👆,0,,,2026-04-20 20:04:16
com.tokopedia.tkpd,06248e0f-0a77-4043-a8ff-7245073a7354,professional007indonesia,5,2026-03-09 17:11:04,Aplikasi Belanja Paling Keren,0,,,2026-04-20 20:04:16
com.tokopedia.tkpd,f1306725-187e-459f-8f5e-f3701a5297d7,Peggy Kakisina,1,2026-03-09 17:10:47,"dulu beli obat resep gampang, bisa pake resep dokter/fitur chat dokter. sekarang ribet bgt. tiap liat obat resep diarahin ke chat dokter, pilihan produk ngga sesuai preferensi. mana resep cuma bisa buat sekali cek produk, kalo keluar harus chat lagi. fitur chat juga sering eror/blank layarnya. tlg diperbaiki soalnya nyusahin. makasi",1,,,2026-04-20 20:04:16
com.tokopedia.tkpd,f4d72914-f364-4507-9794-818eba9c546f,Habibul Rahman Qalbi,1,2026-03-09 17:09:57,"makin lama di buka makin lemot, kayaknya memory leak. layout di tablet Ratio 3x2 (Xiaomi pad 7 & 8 series) juga rusak",2,,,2026-04-20 20:04:16
com.tokopedia.tkpd,187ef3f6-973a-41bc-bcc4-e5c2947acc97,Megga abie,1,2026-03-09 16:41:19,pas aku di capcut pas mau di download selalu ada iklan Tokopedia padahal aku nggk mencet tp mencet sendiri Maksa banget and akhirnya nggk bisa di download kurang sing kata aku,0,,,2026-04-20 20:04:16
com.tokopedia.tkpd,26e2b364-8c97-4beb-b23e-6a6979b5041e,Alvin Ndraha,1,2026-03-09 16:23:13,"saya suka berbelanja disini tapi saya tidak suka kurirnya no respon beda dengan shopee, kurir toko pedia return pesanan sesuka hati dan malas antar pesanan.",0,,,2026-04-20 20:04:16
com.tokopedia.tkpd,f2b54fcb-473c-401a-a7db-0bddb5e217dc,David AP,3,2026-03-09 16:10:45,"Hanya memberikan 3 Saran : 1. Tidak ada fitur foto pencarian. 2. Sering lemot meski sudah di Upgrade. 3. Status pengiriman menunggu melebihi batas waktu, tidak ada pembatalan secara otomatis.",4,,,2026-04-20 20:04:16
com.tokopedia.tkpd,7602a15e-fc70-4f1b-a095-69759bf333bd,A Mi,5,2026-03-09 16:05:34,good ....🫰🏼,0,,,2026-04-20 20:04:16
com.tokopedia.tkpd,9b8ac13e-84a2-4a69-bbe8-54f0c3c62525,Jocker,1,2026-03-09 15:59:20,ongkirnya gak ngotak.. gak masuk akal.. masa setengahnya harga barang.,0,,,2026-04-20 20:04:16
com.tokopedia.tkpd,90e06d3d-fda4-4362-b773-76aac26d1125,Mister Resya,5,2026-03-09 15:48:12,PINJOL INI SANGAT BAGUS,0,,,2026-04-20 20:04:16
com.tokopedia.tkpd,d8d88fa8-9ba2-49d6-af95-dd3dea1a808a,begink 168,1,2026-03-09 15:47:54,"hati hati belanja di tokoped ketika salah barang tidak bisa di reture.. ketika penjual menolak pengembalian tokped tidak bisa berbuat apa apa bahkan tanggapnya bermingu minggu, beda seperti shope.. komplen langsung di proses secara adil.. Demi Allah langsung hapus jangan belanja di sini merugikan pembeli..",0,,,2026-04-20 20:04:16
com.tokopedia.tkpd,1dbf1c5f-4e4b-4e40-9936-f3cf1ed7843c,Robby Ribuansyah,1,2026-03-09 14:48:17,komplen nya ribet,0,,,2026-04-20 20:04:16
com.tokopedia.tkpd,ffa861a5-51b6-4483-ac8c-a48f5cdc7b0e,Shiren Meryana,1,2026-03-09 14:35:14,ada voucher tapi ndak bisa digunakan,0,,,2026-04-20 20:04:16
com.tokopedia.tkpd,3859dd20-ceb8-4599-b4d1-0eb98dc9d91f,Coi Jou,1,2026-03-09 14:23:54,"sekarang tokped gk seperti dulu, sekarang gratis ongkir aja susah 😂 shopee tiap hari gratis ongkir, diskon banyak, sekarang tokped banyak pembatalan oleh sistem, barang yang ada gambarnya logo voucer diskon tapi aslinya emang harganya segitu, jadi diskon gk diskon tetep harganya sama",0,,,2026-04-20 20:04:16
com.tokopedia.tkpd,048e6e0a-6601-4094-940a-ad9b217d2969,Musapir Cinta,4,2026-03-09 14:04:30,baru mau mencoba aplikasi ini apa kah bagus,0,,,2026-04-20 20:04:16
com.tokopedia.tkpd,3826b08a-be71-46ad-b413-373254ea438f,Putri Lhena,1,2026-03-09 13:47:31,"Pelayanan CS super buruk!!!! akhiri chat sepihak tanpa memberikan solusi. kasus pertama akun saya d blokir gara2 melaporkan penipuan,pdahal saya korban nya!!!. kedua barang sameday gk d pickup selama seminggu, tpi gk bisa d batalkan. giliran mnta cs batalkan, nunggu 48 jam. lwt 48 jam masih suruh nunggu 48 jam lagi?!!!. smpai kapan ? dan Cs nya mengakhiri chat seenak dia aja. SOP pelayanan tokped sburuk itukah????",0,"Hai Kak, maaf ya atas ketidaknyamanannya. Kritik dan saran Kakak sangat berarti untuk menjadi dasar pengembangan sistem ini menjadi lebih baik lagi, agar bisa terus memberikan pelayanan yang terbaik demi kenyamanan Kakak. -FK",2020-08-16 13:17:48,2026-04-20 20:04:16
com.tokopedia.tkpd,85c09c5f-0656-4ca5-ab41-8d9ef65a5e89,Dzaki Istiadi,1,2026-03-09 13:30:13,ongkirnya mahal dan tidak ada gratis ongkir bisa bisa orang pada pindah ke aplikasi sebelah,0,,,2026-04-20 20:04:16
com.tokopedia.tkpd,5f74728f-578b-4aa4-8cb2-0bb35ab65664,Rara Alzahra,1,2026-03-09 13:08:19,buruk ga mampu kasih gratis ongkir,0,,,2026-04-20 20:04:16
