app_id,reviewId,userName,score,at,content,thumbsUpCount,replyContent,repliedAt,scraped_at
com.tokopedia.tkpd,ec2ca5f2-3503-43ba-b4a4-fde93262e984,Ashila Hutami Panggarena,1,2026-02-23 19:25:02,kurir ga jelas!! udah 2 hari kaga di kirim!!,0,,,2026-04-20 20:04:16
com.tokopedia.tkpd,4827e783-9b0c-4c4d-9c05-549b6709c15d,Almaira Putri,5,2026-02-23 19:23:32,"Bagus ini aplikasi tokopedia dridulu nyaman digunakan,buat transaksipun jdi mudah,fitur pengoperasianya jua mudah,semua fitur² nya jua sangat baik,,sukses trus dan update trus nntinya,smoga mnjadi apk berkembang pesat di indonesia ini,,",0,,,2026-04-20 20:04:16
com.tokopedia.tkpd,f049b215-7c98-41f3-96ce-fd9279b5b3bc,Rafy Cool,5,2026-02-23 19:16:09,bedebest,0,,,2026-04-20 20:04:16
com.tokopedia.tkpd,8ca419d7-b222-4f72-b4ca-f3fe039569a8,papauyan28@gmail.com oparewauyan,5,2026-02-23 18:57:21,Harus selalu jaga kualitas pelayanan yg prima beserta jaminan mutu barang dagangan dan ketepatan waktu _delivery_.,0,,,2026-04-20 20:04:16
com.tokopedia.tkpd,db5ddb59-5ef9-4d49-843d-b2238a4e0c68,motik runtika,5,2026-02-23 18:55:52,GOOD👍,0,,,2026-04-20 20:04:16
com.tokopedia.tkpd,64dfb7d5-5452-407c-a6de-eb60278bcdd8,Ega Faizal,4,2026-02-23 18:55:17,sngat membantu,0,"Hi Toppers, silakan sampaikan kritik/saran atau kendala transaksi kamu dengan menghubungi Tokopedia Care melalui Di Mana Saya Dapat Menghubungi Tokopedia? | Tokopedia Care agar bisa kami bantu cek lebih lanjut. Kami akan terus berupaya untuk meningkatkan pengalaman Toppers dalam bertransaksi di Tokopedia.",2025-02-16 00:00:11,2026-04-20 20:04:16
com.tokopedia.tkpd,4126ca9e-2039-41e2-8061-b7d2a13f0eda,Ade Mfi,5,2026-02-23 18:52:08,sipok,0,,,2026-04-20 20:04:16
com.tokopedia.tkpd,2b63992c-cbdd-4fa9-a61e-cbabc803dffb,Namidya Meme,1,2026-02-23 18:50:42,niat beli malah promonya ga berlaku. apa akal2an aja buat cari untung,0,,,2026-04-20 20:04:16
com.tokopedia.tkpd,571be6d0-22b0-4769-bb8b-1ee985773145,Ghava Rizki,5,2026-02-23 18:44:39,"tokopedia bagusz murah, belanja di sini banyak untungnya",0,,,2026-04-20 20:04:16
com.tokopedia.tkpd,72569486-3b88-434f-a58d-da757acddfac,jonathan raffael,5,2026-02-23 18:40:41,iya karwna pernyataan bagus kualitas bagus gak ngelek lagi terima kasih melayani kita dengan baik barang barangnya,0,,,2026-04-20 20:04:16
com.tokopedia.tkpd,433370cc-c128-4039-8897-721ee577a5d0,Jdm Indotwind,1,2026-02-23 18:12:45,pihak tok ped slalu membenarkan seler dan ga prnh mau tau buyer yg terugikan..,0,,,2026-04-20 20:04:16
com.tokopedia.tkpd,57d3c5f0-0212-4631-bb38-6fff77a0165e,Bengkel-Baginda harun daulay.,1,2026-02-23 17:59:04,"pusing kepala di buatnya label rumah susah di atur, dan lain sebagainya",0,,,2026-04-20 20:04:16
com.tokopedia.tkpd,e5c43241-006f-4aec-ae97-c00421a230ac,Agus jnk saradan,1,2026-02-23 17:44:38,"PERHATIAN,,,,,,,JANGAN SEKALI2 INSTAL TOKOPEDIA INI,,,LBH BAIK PAKAI SHOOPE, AUTO HAPUS PERMANEN,LBH BAIK PAKAI SHOPEE,TOKOPEDIA SEMAKIN LAMA SEMAKIN NGAWUR,,TERUS TINGKATKAN KUALITAS PENGAWURANNYA",0,,,2026-04-20 20:04:16
com.tokopedia.tkpd,c3c834c0-8414-4a95-a376-5e8d6f7f1132,achmad yani,5,2026-02-23 16:46:21,Toped jangan tutup,0,,,2026-04-20 20:04:16
com.tokopedia.tkpd,84d9ecfd-8190-4e6a-8cd9-5e097c03daef,Hafidz ISLAMUDDIN,1,2026-02-23 16:34:04,"itu kenapa diskon promo ramadan tidak berlaku ya,kecewaa saya",0,,,2026-04-20 20:04:16
com.tokopedia.tkpd,35c50faa-0ded-4ac9-8450-a40dab61db10,Leni Frestiya,4,2026-02-23 16:25:17,biyasa saja,0,,,2026-04-20 20:04:16
com.tokopedia.tkpd,95bc4e74-be84-43f0-89e0-7fa084bde100,Rufaida Ahmadd,1,2026-02-23 15:24:48,"kenapa sekarang Tokopedia tidak ada gratis ongkirnya yaa saya kecewa, masa harga barang sama ongkir sama aja",1,,,2026-04-20 20:04:16
com.tokopedia.tkpd,4af428aa-a136-45db-8bb3-be5891dcef10,anto sudrajat,2,2026-02-23 15:03:05,semoga bermanfaat,0,,,2026-04-20 20:04:16
com.tokopedia.tkpd,f06cf77d-b8f0-4007-8ea6-42754112f300,Emilee Kunti Djamis,4,2026-02-23 14:30:40,aplikasi yang fleksibel dan mudah di gunakan,0,,,2026-04-20 20:04:16
com.tokopedia.tkpd,0caa9e81-4077-42fc-a44b-37501d9939df,ولله اعلم,1,2026-02-23 14:24:02,coba kalo iklan di aplikasi lain jgn maksa bgt buat nginstal napa,0,,,2026-04-20 20:04:16
com.tokopedia.tkpd,e9437be8-86a3-4864-be99-84bf03ee3d51,Putik Apuntika,1,2026-02-23 14:03:54,"harganya berubah sendiri waktu beli gila bener, untung teliti. gila bener ini aplikasi cari duitnya",0,,,2026-04-20 20:04:16
com.tokopedia.tkpd,4344ed3d-f734-4ad0-8fc8-d79a88729781,Awan Nawan Nawan,3,2026-02-23 12:58:33,"setelah sayah instal lagi kok tidak bisa masuk akun,trus harus instal lagi Tokopedia tiktok, kok aneh padahal sayah lagi pesan barang tapi tidak bisa masuk gmna ini",0,,,2026-04-20 20:04:16
com.tokopedia.tkpd,4078d128-8301-44bd-95ca-ca110d75e8d4,Sodik Gagego,1,2026-02-23 12:55:32,IKLAN SANGAT MENGANGGU,0,,,2026-04-20 20:04:16
com.tokopedia.tkpd,d5871555-fb0a-4fae-996a-594e5118cbab,Arrechal Chal,5,2026-02-23 12:28:51,can di cobaan kalem,0,,,2026-04-20 20:04:16
com.tokopedia.tkpd,e4156b61-3b91-4dc4-833b-f530ea3544cb,asikin aja,5,2026-02-23 12:11:19,dg begaya dn wajah cantik baju dn apapun kita pakai pasti cant8k,0,,,2026-04-20 20:04:16
com.tokopedia.tkpd,aefb360f-2ddb-4c3f-ae6a-6c4b65152b35,Ibu Nanih,1,2026-02-23 12:04:04,iklan nya ganggu banget,0,,,2026-04-20 20:04:16
com.tokopedia.tkpd,03852b9f-2fcb-42ae-a281-ba10d3758d62,Asolole,1,2026-02-23 11:07:45,gajelas notifnya,0,,,2026-04-20 20:04:16
com.tokopedia.tkpd,5bc30ce0-b66b-44c8-92be-89e46f633908,Teguh Prakoso,5,2026-02-23 10:31:12,pulsa termurah tks kaka,0,,,2026-04-20 20:04:16
com.tokopedia.tkpd,95c383d4-9cfe-4a0a-ae54-5bf5161bf25c,Herikris R7 YOG,1,2026-02-23 10:30:49,noifikasi suara di HP ganggu banget woiii gak tau waktu lagi sholat jumat tiba tiba bunyi,0,,,2026-04-20 20:04:16
com.tokopedia.tkpd,2fbf3ab4-8b15-4328-902a-ac2c0d5f12e2,Kang Wib,5,2026-02-23 10:09:26,ini lho yg saya tunggu. semakin banyak barang dengan metode bayar COD. dan banyak promo. semoga kedepanya lebih bagus dari toko sebelah 👍,0,,,2026-04-20 20:04:16
com.tokopedia.tkpd,84b65bab-8ddd-4bfc-8e29-7ad872d5f5c7,agus sumianto,1,2026-02-23 09:28:59,Jangan sampai kalian pinjam uang di aplikasi ini. Telat 1 hari pembayaran. Kalian akan di Ancam oleh DC. DC nya kampungan & Arogan.,0,,,2026-04-20 20:04:16
com.tokopedia.tkpd,528bceb3-506f-4ba5-a4f9-ded8e1394389,Cahyo Yono,5,2026-02-23 09:00:09,oke respon cepat,0,,,2026-04-20 20:04:16
com.tokopedia.tkpd,ae660be7-e0e3-49c8-afd3-2e4a18395563,Puput Sianturi,1,2026-02-23 08:12:26,"ini gimana ya, sudah 3hari saldo refund saya blm cair ke rekening, status masih diproses terus, udh lapor ke custumer service tanggepannya itu2 aja di ulang2 terus.. tolonglah cepetnya diproses uang saya!!!!",1,,,2026-04-20 20:04:16
com.tokopedia.tkpd,07a3e2cc-7e9e-4ac5-b408-ae95748e5a92,Bang Ikky,1,2026-02-23 07:51:47,"KAGA JELAS BANGET TOKPED INI, NGASIH CASHBACK BONUS TAPI KAGA BISA DIPAKE PISAN... SEKALI PUN BISA DIPAKE DAPET BONUS 125RB BISA KEPAKE CUMA 2REBU PERAKKK KOCAKKK!!! ANEH BIN NYATA",0,"Halo Toppers, terima kasih atas rating yang kamu berikan. Kami akan terus melakukan perkembangan pada aplikasi Tokopedia untuk terus memberikan keamanan dan kenyamanan Toppers dalam bertransaksi.Silakan sampaikan kritik/saran atau kendala transaksi kamu dengan menghubungi Tokopedia Care melalui tkp.me/supportMainapps.",2025-03-06 05:40:08,2026-04-20 20:04:16
com.tokopedia.tkpd,a56c72f2-8804-4c1b-8fe5-9fa27977b930,Abu Zack,5,2026-02-23 07:16:08,"apk nya bagus, banyak promonya.sistem pembayaran juga mudah.",0,,,2026-04-20 20:04:16
com.tokopedia.tkpd,7214f608-2019-4947-b56d-868b597ef49b,Reva Julia,1,2026-02-23 05:20:13,palsu,0,,,2026-04-20 20:04:16
com.tokopedia.tkpd,13f852ee-28bc-479d-acef-48a0961bb322,Kka Dama,1,2026-02-23 05:06:47,aplikasi ngelag terus beda sama toko sebelah,0,,,2026-04-20 20:04:16
com.tokopedia.tkpd,d5d9e16a-f29b-4038-93e1-1ae18ba548b6,Tomy Toisuta,5,2026-02-23 05:02:36,Tokopedia sangat bermanfaat dalam dunia usaha. dan bisnis.🙏🔥,0,,,2026-04-20 20:04:16
com.tokopedia.tkpd,e8f4e7a8-2174-4c40-9447-f9544a482283,joko ganti,1,2026-02-23 04:56:28,"aplikasi sering logout sendiri, sinyal sudah wifi, hp samsung a7 2018. sehari bisa 6 - 8 kali logout",1,"Hai Kak Ony, silakan infokan detail kendala Kakak dengan melampirkan nama device, Operation System HP, versi aplikasi Tokopedia, detail kendala, screenshot/video yang diupload di streamable.com dan infokan linknya ke tkp.me/report agar kami bantu cek lebih lanjut. Makasih -KK ",2020-02-19 09:52:52,2026-04-20 20:04:16
com.tokopedia.tkpd,ab420ff9-dbe4-491a-b6fb-db8df521bd87,Lydia Sari,5,2026-02-23 04:44:56,Tokped harus maju diatas orange,0,,,2026-04-20 20:04:16
com.tokopedia.tkpd,a08f3675-c6dc-4163-9ad0-308c9eebc7eb,Putri Sakti,1,2026-02-23 04:30:08,"Kenapa pas check in kejar ketupat aku ga dapat voucher kaya biasanya?? Aku check in jam 3 pagi ga dapat tulisannya (Vouchernya habis, tapi kamu dapat +640 ketupat) jadi cuma dapat poin ketupat aja ga dapat voucher. Padahal akun teman aku check in di jam 10 pagi masih dapat loh. Akun tokpedku kenapaa beda?? males banget dibeda2in gini. Hubungi CS gaada solusi",52,"Hi Toppers, silakan sampaikan kritik/saran atau kendala transaksi kamu dengan menghubungi Tokopedia Care melalui tkp.me/supportMainapps agar bisa kami bantu cek lebih lanjut. Kami akan terus berupaya untuk meningkatkan pengalaman Toppers dalam bertransaksi di Tokopedia.",2025-04-10 05:47:02,2026-04-20 20:04:16
com.tokopedia.tkpd,324a1f0e-eae4-4036-95fb-891f89c7a7b8,Rif,5,2026-02-23 04:27:55,sangat sangat membantu,0,,,2026-04-20 20:04:16
com.tokopedia.tkpd,74d50de5-3522-49b4-97d0-7b53af01f82d,ilham Haq,5,2026-02-23 04:19:19,"pelayanan bagus,stiap ada masalah pengembalian dana mudah dan cepat",0,,,2026-04-20 20:04:16
com.tokopedia.tkpd,a614e200-7a67-4170-87c5-0f9f085579dd,Ikhsan Sidik,2,2026-02-23 04:06:22,apk sering banget eror,0,,,2026-04-20 20:04:16
com.tokopedia.tkpd,b24dfd1c-cbe3-44fb-999b-1b497c5b63d0,Erick Rumokoy,5,2026-02-23 02:39:01,seru,0,,,2026-04-20 20:04:16
com.tokopedia.tkpd,d0b04940-e7df-4db9-9df0-317e0e94c00b,Irwan Syahputra,5,2026-02-23 00:28:51,bnyak promo mantap lah pokoknya.. udah gak pernah lagi ke aplikasi lain kalau belanja selalu tokopedia 👍,1,,,2026-04-20 20:04:16
com.tokopedia.tkpd,8bebe8c8-f72b-4787-8ed1-f1c1ff23211b,Fachrul Rizal,1,2026-02-22 23:55:02,Sukak ngelag gak jelas,0,,,2026-04-20 20:04:16
com.tokopedia.tkpd,261dd735-f1bc-4da4-a0c5-b6a373082aaa,Uswatun Hasanah,1,2026-02-22 23:52:30,"vc plus tiba2 hilang, padahal saya berbelanja sebagaimana mestinya, jd harga barang tiba2 sangat mahal, kecewa bgt sama apk ini, padahal koin masih banyak, jadi hangus tidak bisa digunakan",14,,,2026-04-20 20:04:16
com.tokopedia.tkpd,aaf03d01-2ee1-4edf-b8ab-f3226c7abad8,Ligo Rius,1,2026-02-22 23:18:23,akun saya di nonaktifkan secara sepihak tanpa keputusan dari saya data dan uang saya trus gimana penyelesaian dari admin cuma sekedar bot yang menjawab mengecewakan ga bakal pakai ni lagi kecewa berat,0,,,2026-04-20 20:04:16
com.tokopedia.tkpd,fc9c5dde-050f-46b0-b7ca-fe9159684653,Pengguna Google,2,2026-02-22 23:17:08,"makin kesini makin kesono... banyak penipu, barang ga dikirim, asuransi ribet,",1,,,2026-04-20 20:04:16
com.tokopedia.tkpd,a9466c9e-6bcb-4349-b0a5-f26f620ab981,Yudi Hartono,5,2026-02-22 22:33:34,mantap..,0,,,2026-04-20 20:04:16
com.tokopedia.tkpd,c937f363-7ab9-4081-9272-37469b6b950f,Raya Irwansyah,1,2026-02-22 22:05:44,"Tolong iklan di atur secara detail,, hampir 3 selalu muncul di layar hp",0,,,2026-04-20 20:04:16
com.tokopedia.tkpd,5be5aead-b1b9-486d-9739-40735bf8db9e,Grace leen,1,2026-02-22 21:29:28,"ga bisa pakai gopaylater pdhal ga pernah telat byr tagihan dan udah lama ga dipakai,ga berguna limit besar juga,tdnya ada menu pembayaran tapi tiba tiba ilang begitu saja,bagus jadi tidak perlu belanja disini lagi smpai kapanpun",6,,,2026-04-20 20:04:16
com.tokopedia.tkpd,2b5664f4-9d3c-4493-bae7-41836b892dfa,Danar Analengpe,1,2026-02-22 21:02:32,"Parah amat lagnya, bentar² not responding dan ujung²nya ""aplikasi tidak menanggapi"". Padahal hp saya sudah android 15 dan ram 12gb.",28,,,2026-04-20 20:04:16
com.tokopedia.tkpd,3889f1b0-f61c-41e7-8648-d8b2f8ee6f4e,Amirul Wildan,1,2026-02-22 20:09:40,"kenapa sekarang suara notifnya jelek banget, gaenak banget didengerin, bagusan yang lama",0,,,2026-04-20 20:04:16
com.tokopedia.tkpd,253806a6-96c2-47ef-8f39-1ca4e3567374,Gilang Ramadhan,1,2026-02-22 19:53:27,Tokopedia makin lama makin parah. Biaya layanan makin mencekik. Uang seller ditahan sampe seminggu lebih. Barang di etalase juga sering di takedown tanpa alasan yang jelas. Orang jualan barang Original malah sempat kena moderasi karena laporan penjual barang KW. Pusat bantuan dijawab auto-bot. Bintang 1 !,0,,,2026-04-20 20:04:16
com.tokopedia.tkpd,9fb09df6-1013-4ab5-8c6a-9753b100de2f,Yogi sapto,5,2026-02-22 19:45:35,Kenapa tidak bisa di buka,0,,,2026-04-20 20:04:16
com.tokopedia.tkpd,1b6a18b2-d0b9-4d42-a4ed-3e8117a3a972,candra oby saputra,1,2026-02-22 19:37:55,ongkirnya gak ngotak. mahalan ongkir dari pada barang,0,,,2026-04-20 20:04:16
com.tokopedia.tkpd,89c6e9ef-c24a-414f-ad0d-d4f19cdae13c,freddy vs,5,2026-02-22 19:14:28,cara praktis dan simpel dlm bertransaksi/pembayaran belanja. 👍,0,,,2026-04-20 20:04:16
com.tokopedia.tkpd,3ad438c9-31cc-4a24-9c00-b2686a4a8ae4,Reynovac Fransisco,5,2026-02-22 18:49:34,Selalu asyik kalo belanja disini pilihan barang lengkap murah & LG ada promo gratis ongkir,2,,,2026-04-20 20:04:16
com.tokopedia.tkpd,7fd2cada-537e-4545-9a2b-2b3c5ef8185d,Erza Eras,3,2026-02-22 18:22:50,katanya gratis ongkir tapi tetap aja ongkirnya gede 😔🤦🏼‍♀️,1,,,2026-04-20 20:04:16
com.tokopedia.tkpd,8fd39f02-bf92-4088-84eb-87cb8b6b5ad4,junet gendong,1,2026-02-22 18:20:41,"belanja di Tokopedia ongkir terlalu mahal, mending belanja di shopee ongkos kirim murah kadang ada gratis ongkir",0,"Halo Toppers, terima kasih atas rating yang kamu berikan. Kami akan terus melakukan perkembangan pada aplikasi Tokopedia untuk terus memberikan keamanan dan kenyamanan Toppers dalam bertransaksi. Silakan sampaikan kritik/saran atau kendala transaksi kamu dengan menghubungi Tokopedia Care melalui tkp.me/supportMainapps.",2024-09-30 10:40:03,2026-04-20 20:04:16
com.tokopedia.tkpd,d2a81743-b736-4d38-9cdd-883f67a94c41,Putra Kastara,3,2026-02-22 18:14:49,tolong perbaiki banyak bug nya sekarang lemot kalau cari sesuatu harus keluar masuk,1,,,2026-04-20 20:04:16
com.tokopedia.tkpd,008b1446-cf4b-4d15-8a9e-51c8ad0e07a0,Bambang Fitriyanto,1,2026-02-22 18:12:56,setiap buka HP selalu muncul iklan ini,0,,,2026-04-20 20:04:16
com.tokopedia.tkpd,be200a99-78c2-442f-9ed7-2006c4b55e90,heriyanto Cianjur,5,2026-02-22 17:59:39,mantul poko yah,0,,,2026-04-20 20:04:16
com.tokopedia.tkpd,179420b7-db95-4982-8813-4542e4bf84d8,Nouren Mikaylasabyan,5,2026-02-22 17:49:09,nice shopping,0,,,2026-04-20 20:04:16
com.tokopedia.tkpd,d802b00b-9ff5-41da-99a9-8b47a3498448,muhammad edzarhafis,1,2026-02-22 16:59:43,alah iklan ganggu ribet toko pedia ga jelas👎🏻👎🏻👎🏻👎🏻,0,,,2026-04-20 20:04:16
com.tokopedia.tkpd,ef051c22-cedb-4e7d-a059-3dc4368510b2,Edelweeis,5,2026-02-22 16:11:19,"Barang ori semua, sesuai yang saya harapakan si. Cuma mahal aja dari ongkir tapi sesuai si 🤙",0,,,2026-04-20 20:04:16
com.tokopedia.tkpd,f83a4b78-d7fb-444e-bb33-3b2adef04f99,Budi Setiawan,1,2026-02-22 16:10:49,"pihak toko pedia hrs lebih respon untuk barang yg di pesan berjln 2 hr tdk ada pengiriman hrsnya bisa di batalkan, bukan nunggu sampai berhari hari. buang buang wkt sj mengapa tidak ada penilain untuk kurir paket harusnya ada biar pihak jasa pengiriman tau mana kurir yg bagus kinerjanya sm yg tdk bagus...",6,,,2026-04-20 20:04:16
com.tokopedia.tkpd,c6743838-c592-40da-801e-a40ab6c8c753,Murtado Zuhri,1,2026-02-22 14:59:29,"Payah banget, alamat sudah sesuai dan nomor kontak bisa dihubungi tiba-tiba paket mau diretur dengan alasan pembeli menolak paket. Ekspedisi J&T hobi fitnah pembeli. Gak heran Shopee gak mau kerjasama sama mereka.",7,,,2026-04-20 20:04:16
com.tokopedia.tkpd,feefcb0a-5434-4e4b-8e7f-528a95b278d9,Yakub Saryanto,5,2026-02-22 14:50:47,Barang bagus diperlukan,0,,,2026-04-20 20:04:16
com.tokopedia.tkpd,3d1f5737-cedd-45f6-a473-bb4539e2b9d8,Keyla Simanjuntak,1,2026-02-22 14:15:46,"saya bingung menggunakan nya, dan harga yg sangan mahal sekaliiiii",0,,,2026-04-20 20:04:16
com.tokopedia.tkpd,a8e70595-b2a6-41f1-a147-6f0cfde9758f,Tanto Cepri,4,2026-02-22 14:07:45,blnja di tokopedia lmyan puas harga nya ada yang mrah juga mhal semoga slalu berlangganan,0,,,2026-04-20 20:04:16
com.tokopedia.tkpd,5f204cc2-4e9c-4a54-baa7-ee40e2813e36,Deni Irawan,1,2026-02-22 13:55:44,saya kasih rating disini karena tokopedia are gak ngasih solusi. Ngasih free ongkir gak taunya kurir Abal Abal...dan tidak sesuai estimasi waktu dan pada jatuh tempo tgl nya malah perpanjang sepihak...menentukan seenaknya saja.....Sudah waktunya UN INSTALL...masih banyak e-commerce yg lain yg pelayanannya bagus dan profesional,8,"Hi Toppers, silakan sampaikan kritik/saran atau kendala transaksi kamu dengan menghubungi Tokopedia Care melalui Di Mana Saya Dapat Menghubungi Tokopedia? | Tokopedia Care agar bisa kami bantu cek lebih lanjut. Kami akan terus berupaya untuk meningkatkan pengalaman Toppers dalam bertransaksi di Tokopedia.",2024-01-30 09:20:02,2026-04-20 20:04:16
com.tokopedia.tkpd,a78e38a2-69d8-4847-8245-d3a58be52681,Gundam Budiarjo,4,2026-02-22 13:32:30,proses transaksinya cepat,0,,,2026-04-20 20:04:16
com.tokopedia.tkpd,3cfcdbf4-e8d2-4c31-a6c0-5b4eea80a407,Ve Ve,1,2026-02-22 12:38:32,"ni lapak angker kayaknya cekout 3 barang di 3toko tapi seller gada yg aktif respon chat,, tokonya mati kali ya, gada yg laku , hubungin CS juga susah bangt,g kaya di sopi sm lazada, yg jwb robot mulu pdhl udah minta dihubungkan ke CS manusia, mana paham. gedek bngt",1,,,2026-04-20 20:04:16
com.tokopedia.tkpd,a7413daf-814c-4bfd-bad1-acc9547504a5,KATMI,5,2026-02-22 12:34:32,Bintang 5,0,,,2026-04-20 20:04:16
com.tokopedia.tkpd,eadf2a56-1f66-48f3-8ca5-fb932272e7b0,Paz Vegas,5,2026-02-22 12:27:35,kenapa terjadi bug pada metode lacak perjalanan pesanan ?,2,"Hi Toppers, terima kasih untuk rating dan ulasan baiknya, ya! Kami akan terus meningkatkan performa aplikasi, fitur serta layanan agar bisa memberikan pengalaman bertransaksi terbaik bagi semua pengguna. Yuk tingkatkan terus transaksi kamu!",2025-01-09 12:08:03,2026-04-20 20:04:16
com.tokopedia.tkpd,bafec87d-0871-4493-9fe3-4118dba8d462,M Asth,1,2026-02-22 11:56:20,"ajg memang komplan barang, mau bukti video harus ada ukuran file maximalminimal sekian. bukti video yang ukuran file nya lebih ga bisa. jadi rugi pembeli kalo begini mau komplan jadi dipersulit.",2,,,2026-04-20 20:04:16
com.tokopedia.tkpd,af74964b-4a23-4af7-b364-ec5df682e383,Caplin 336,1,2026-02-22 11:47:42,"Tokopedia gak jelas. 5 hari pengiriman ke alamat, kurirnya gak datang datang. besoknya malah dikembalikan lagi ke penjual udalah jauh lagi ke pulau sebrang. kurir malas itu gak usah jadi kurir. bodoh",0,,,2026-04-20 20:04:16
com.tokopedia.tkpd,4a4fdcf7-639b-4f77-a3e4-d78f7c1156a5,Nilam Sahra,1,2026-02-22 11:41:55,pas pesen harganya berubah mahal. hati2 ketipu cek dulu harganya,0,,,2026-04-20 20:04:16
com.tokopedia.tkpd,68d8cf2b-80dd-445d-98ac-2ebf67c8f907,Wijaya Hermanto,1,2026-02-22 11:19:59,Agak ribet nomor lama kapan waktu bs hangus it hrs dipikirin keras oleh pihak tokopedia,0,,,2026-04-20 20:04:16
com.tokopedia.tkpd,bcad5c57-00c4-46b2-94fc-5786fb2e0030,Saepuloh,3,2026-02-22 11:16:40,"Aplikasinya berat banget, padahal hp saya engga jelek jelek amat terus koneksi internet stabil tapi pas buka aplikasi toped lemotnya minta ampun, seperti buka aplikasi pakai hp jadul, padahal kalau buka aplikasi lain lancar2 saja.",16,,,2026-04-20 20:04:16
com.tokopedia.tkpd,d7115f52-c6a0-4c9e-921a-3088e0f80968,Poco X55g,1,2026-02-22 11:10:55,pay later gk bisa d gunain padahal telat bbrapa hari itu pun sudah d bayar yg sbelumnya lancar berapa kali paylater. hanya karna 2 hari ter lambat.semuanya ikut jelek,0,,,2026-04-20 20:04:16
com.tokopedia.tkpd,bed46326-e374-4e68-b71e-2cff628c5319,keriting jimbal,5,2026-02-22 10:29:45,per hari ini tgl 22 feb 26 saya uninstall toko pedia krn tidak ada keperluan lagi. terima kasih..,0,,,2026-04-20 20:04:16
com.tokopedia.tkpd,c796e634-d9bb-4d0f-af23-664fb8ea550a,Arie Syahrimudhiri,5,2026-02-22 10:17:34,🇮🇩👍🏻🇮🇩,0,,,2026-04-20 20:04:16
com.tokopedia.tkpd,c51f65bc-ac47-4bf3-8125-f3409bad9bfd,Defi Ernawati,1,2026-02-22 09:19:47,buruk bgt pokoknya. gk prnah diperbaiki kyk e,0,,,2026-04-20 20:04:16
com.tokopedia.tkpd,c94371a8-0c3e-4ea8-a4bb-01565fbadc58,Tri Mardianto,1,2026-02-22 08:58:53,"buruk pelayanan CS, kalau ada masalah CS lepas tangan. nggak guna. padahal ini aplikasi yang managemen, masa giliran ada masalah lepas tangan.. nggak bermutu.. kalau ada bintang 0 saya kasih",1,,,2026-04-20 20:04:16
com.tokopedia.tkpd,de563bd3-e6e3-440b-9eea-28b7994679ea,Pencari Ilmu.,1,2026-02-22 08:52:09,"sekarang aplikasi tokopedia saya eror, kalau mau bayar belanjaan gak bisa. mohon bantuannya",0,"Toppers, terima kasih atas rating yang kamu berikan serta kepercayaan kamu dalam memilih Tokopedia sebagai tempat berbelanja online. Jika kamu punya kritik/saran, atau ada kendala pada aplikasi Tokopedia, silakan info melalui http://tokopedia.com/help",2023-10-09 09:51:01,2026-04-20 20:04:16
com.tokopedia.tkpd,2054da53-8cdd-432d-9748-4d96839171c8,nur dental klinik,5,2026-02-22 07:49:33,"pelayanan bagus,",0,,,2026-04-20 20:04:16
com.tokopedia.tkpd,83360b9f-a2ee-40bc-aa65-0f4329b7a91b,Zahra Cell 02,1,2026-02-22 07:37:09,"Promo gak masuk akal, Harga diup sampe gak masuk akal, jatuhnya harga normal",0,,,2026-04-20 20:04:16
com.tokopedia.tkpd,4b0233f3-9691-4a5a-8938-60918a76a8ac,Affronsyah,1,2026-02-22 07:00:25,"ongkir yang tidak wajar pada umumnya, set penjual/pengiriman dari Tangerang ke Malang berat barang di 4 kg tertera biaya ongkir 150 rb an 🤣 haduh parah kemudian ada diskon ongkir jadi 77 rb an 🤣🤦🏻 ini tambah parah padahal dikurangi(diskon), masak ongkir Tangerang - Malang 77 rb. Saya rasa diskon, nilai ongkir, okelah itu trik. tapi 4 kg ongkir 77rb Tangerang - Malang seperti menjadi ""Pemb*h*n9an publik"" 🤦🏻 karena seringnya ongkirnya itu kena di kisaran 30-40 rb",6,,,2026-04-20 20:04:16
com.tokopedia.tkpd,89902b5b-682d-4730-9d61-d1ec6645b069,Verry Libre Lazuardi,1,2026-02-22 06:58:54,"Lag, lemot, bug dan klo back filter kereset.",16,,,2026-04-20 20:04:16
com.tokopedia.tkpd,7c8b45bb-fb55-4281-b719-2a9bbd2ec394,Ani zf,1,2026-02-22 06:26:12,"Tokopedia care yang tidak care, laporan kendala pengembalian dana tidak ada penjelasan lebih lanjut tiba tiba sudah di closed, padahal sudah diminta foto KTP dan foto bagian depan mbanking, sudah dikirim, Toped care suruh tunggu kayanya akan diselidiki lebih lanjut, tp tunggu punya tunggu dicek berkala, tiba tiba pelaporan di cloaed tanpa penhelasan lebih la jut bagaimana hasil penyelidikannya, saat membuat pelaporan ulang pun, hanya dibuatkan tiket pelaporan baru tanpa penjelasan lebih lanjut",7,,,2026-04-20 20:04:16
com.tokopedia.tkpd,7035f8c6-f55c-4be5-9e34-c0e020510817,Khoirul Fuad,5,2026-02-22 06:16:19,kualitas terjaga,0,,,2026-04-20 20:04:16
com.tokopedia.tkpd,40b0e998-d67d-47e8-8d37-f67787a0d574,Made Suwandika,1,2026-02-22 06:13:33,"saya sebenarnya sudah bertahun-tahun pakai Tokopedia ,,tapi ini bentuk kekecewaan saya terhadap Tokopedia,,, jadi sy beli sesuatu(Handphone )di Tokopedia,tapi ternyata yg datang bukan HP tapi hanya case HP,,,,sy berupaya untuk mengajukan komplain tapi tidak bisa dan tidak ditanggapi sama sekali,,,jelas Sy kehilangan kepercayaan terhadap Tokopedia yg sy pikir bisa belanja online dgn aman .user ID 14413268",0,,,2026-04-20 20:04:16
com.tokopedia.tkpd,5cd7b681-6924-4838-8aca-da16bd88dde7,Luthfi Haryamto,5,2026-02-22 04:48:08,KENAPA APLIKASI NYA JADI BERASA BERAT BANGET. PADAHAL INTERNET AMAN. TAPI WAKTU SCROLL KAYAK GA ADA INTERNET DAN BERAT SEKALI,8,"Hi Toppers, silakan sampaikan kritik/saran atau kendala transaksi kamu dengan menghubungi Tokopedia Care melalui tkp.me/supportMainapps agar bisa kami bantu cek lebih lanjut. Kami akan terus berupaya untuk meningkatkan pengalaman Toppers dalam bertransaksi di Tokopedia.",2025-03-22 15:47:34,2026-04-20 20:04:16
com.tokopedia.tkpd,e0ed4c65-726b-4510-8dfd-8738553f9ed0,Arthadiptaa,1,2026-02-22 04:45:09,udah kebanyakan eror kacau sekelas Tokopedia. Tokopedia sudah mulai down,0,,,2026-04-20 20:04:16
com.tokopedia.tkpd,a1ccc0a9-6d96-4709-bbb6-ef4c797e821a,Lida Nurlida,5,2026-02-22 04:40:38,Belanja cerdaa,0,,,2026-04-20 20:04:16
com.tokopedia.tkpd,d8f19fa9-c830-4a98-85cc-625c36255428,Hoby Burung,1,2026-02-22 04:37:03,"jangan sekali kali beli toko pedia, uang refaund saya di tahan di tokopedi udah 1 bulan lebih",0,,,2026-04-20 20:04:16
com.tokopedia.tkpd,f328d918-2027-46f3-8b40-c24c54ceef55,keanebennedict,1,2026-02-22 04:29:42,"barang di batalin kok saldo belum dikembaliin? keterangan katanya sudah di balikin, tapi di bank tsb, belum ada pengembalian.",0,,,2026-04-20 20:04:16
com.tokopedia.tkpd,96677595-e7dd-4174-b879-a22dbf1dcb69,ncank,5,2026-02-22 04:24:29,"mantap,murah gila",0,,,2026-04-20 20:04:16
com.tokopedia.tkpd,c976f38e-4747-4160-a0b8-a72fd6265ebd,M. Yunus Roikhan Ramadani,3,2026-02-22 04:20:58,Aplikasinya please lah perbaiki.. Dipakai scrol 10 menitan aplikasi udh mulai crash (berat).. Selalu begitu,1,,,2026-04-20 20:04:16
com.tokopedia.tkpd,0905cd2d-ef54-4418-9f8c-0e09dfa4284c,Athar Di Gio,4,2026-02-22 04:07:55,kekurangannya cm 1 kalo apk eror ga bisa melihat barang terakhir di lihat2,0,,,2026-04-20 20:04:16
com.tokopedia.tkpd,b2bb9755-521a-4c9c-a978-7fd1a085858e,alzenna utomo,2,2026-02-22 04:07:40,"makin k sini makin kesono,, free ongkir ga ada, cashback apalagi, beda sama sebelah",0,,,2026-04-20 20:04:16
